gj04	1		bill pushed harry off the sofa .
gj04	1		the kittens yawned awake and played .
gj04	1		our friends wo n't buy this analysis , let alone the next one we propose .
gj04	1		one more pseudo generalization and i 'm giving up .
gj04	1		one more pseudo generalization or i 'm giving up .
gj04	1		the more we study verbs , the crazier they get .
gj04	1		day by day the facts are getting murkier .
gj04	1		i 'll fix you a drink .
gj04	1		fred watered the plants flat .
gj04	1		bill coughed his way out of the restaurant .
gj04	1		we 're dancing the night away .
gj04	1		herman hammered the metal flat .
gj04	1		the critics laughed the play off the stage .
gj04	1		the pond froze solid .
gj04	1		bill rolled out of the room .
gj04	1		the gardener watered the flowers flat .
gj04	1		the gardener watered the flowers .
gj04	1		bill broke the bathtub into pieces .
gj04	1		bill broke the bathtub .
gj04	1		they drank the pub dry .
gj04	0	*	they drank the pub .
gj04	1		the professor talked us into a stupor .
gj04	0	*	the professor talked us .
gj04	1		we yelled ourselves hoarse .
gj04	0	*	we yelled ourselves .
gj04	0	*	we yelled harry hoarse .
gj04	1		harry coughed himself into a fit .
gj04	0	*	harry coughed himself .
gj04	0	*	harry coughed us into a fit .
gj04	1		bill followed the road into the forest .
gj04	1		we drove highway 5 from sd to sf .
gj04	1		fred tracked the leak to its source .
gj04	1		john danced waltzes across the room .
gj04	1		bill urinated out the window .
gj04	1		bill coughed out the window .
gj04	1		bill bled on the floor .
gj04	1		the toilet leaked through the floor into the kitchen below .
gj04	1		bill ate off the floor .
gj04	1		bill drank from the hose .
gj04	1		this metal hammers flat easily .
gj04	1		they made him president .
gj04	1		they made him angry .
gj04	0	*	they caused him to become angry by making him .
gj04	0	*	they caused him to become president by making him .
gj04	0	*	they made him to exhaustion .
gj04	1		they made him into a monster .
gj04	1		the trolley rumbled through the tunnel .
gj04	1		the wagon rumbled down the road .
gj04	1		the bullets whistled past the house .
gj04	1		the knee replacement candidate groaned up the stairs .
gj04	0	*	the car honked down the road .
gj04	0	*	the dog barked out of the room .
gj04	1		the dog barked its way out of the room .
gj04	1		bill whistled his way past the house .
gj04	1		the witch vanished into the forest .
gj04	1		bill disappeared down the road .
gj04	0	*	the witch went into the forest by vanishing .
gj04	1		the witch went into the forest and thereby vanished .
gj04	1		the building is tall and wide .
gj04	0	*	the building is tall and tall .
gj04	1		this building is taller and wider than that one .
gj04	1		this building got taller and wider than that one .
gj04	1		this building got taller and taller .
gj04	0	*	this building is taller and taller .
gj04	0	*	this building got than that one .
gj04	0	*	this building is than that one .
gj04	1		bill floated into the cave .
gj04	0	*?	bill floated into the cave for hours .
gj04	0	*?	bill pushed harry off the sofa for hours .
gj04	1		bill floated down the river for hours .
gj04	1		bill floated down the river .
gj04	1		bill pushed harry along the trail for hours .
gj04	1		bill pushed harry along the trail .
gj04	1		the road zigzagged down the hill .
gj04	1		the rope stretched over the pulley .
gj04	1		the weights stretched the rope over the pulley .
gj04	1		the weights kept the rope stretched over the pulley .
gj04	1		sam cut himself free .
gj04	1		sam got free by cutting his finger .
gj04	1		bill cried himself to sleep .
gj04	0	*	bill cried sue to sleep .
gj04	1		bill squeezed himself through the hole .
gj04	1		bill sang himself to sleep .
gj04	1		bill squeezed the puppet through the hole .
gj04	1		bill sang sue to sleep .
gj04	0	*	the elevator rumbled itself to the ground .
gj04	1		if the telephone rang , it could ring itself silly .
gj04	0	*	she yelled hoarse .
gj04	0	*	ted cried to sleep .
gj04	1		the tiger bled to death .
gj04	1		he coughed awake and we were all overjoyed , especially sierra .
gj04	1		john coughed awake , rubbing his nose and cursing under his breath .
gj04	1		john coughed himself awake on the bank of the lake where he and bill had their play .
gj04	1		ron yawned himself awake .
gj04	1		she coughed herself awake as the leaf landed on her nose .
gj04	1		the worm wriggled onto the carpet .
gj04	1		the chocolate melted onto the carpet .
gj04	0	*	the ball wriggled itself loose .
gj04	1		bill wriggled himself loose .
gj04	1		aliza wriggled her tooth loose .
gj04	1		the off center spinning flywheel shook itself loose .
gj04	1		the sailors rode the breeze clear of the rocks .
gj04	1		the weights made the rope stretch over the pulley .
gj04	1		the mechanical doll wriggled itself loose .
c_13	0	*	i gave yourself the bucket of ice cream .
c_13	1		who do you think bought the bread machine ?
c_13	1		who did bill say frank claimed that mary seems to have been likely to have kissed ?
c_13	1		dave , dan , and alina left .
c_13	1		everyone should be able to defend themselves .
c_13	1		the student met to discuss the project .
c_13	1		john kissed the blarney stone .
c_13	0	*	i spared the trouble to him .
c_13	1		susan bought her mother some flowers .
c_13	1		the student loved his syntax assignments .
c_13	1		the student hated his morphology professor .
c_13	1		i like big bowls of beans .
c_13	1		shannon kissed the kitten quietly .
c_13	1		the kitten was licked .
c_13	1		john said that he played basketball .
c_13	1		i have no money on me .
c_13	0	*	the book of poems of fiction with a red cover takes a very long time to read .
c_13	1		andy frequently eats sushi with his boss .
c_13	1		heidi said that john loves peanut butter .
c_13	1		i know he eats asparagus .
c_13	1		stalin may think that roosevelt is a fool .
c_13	1		we 're all at school .
c_13	1		i love it .
c_13	1		george thinks that julia cooked some beef waffles for him .
c_13	1		gwen saw a fire truck .
c_13	1		it is sunny in the dining room .
c_13	0	*	i think john to like his beer .
c_13	1		calvin did a back flip .
c_13	0	*	spot plays not with his mouse .
c_13	0	*	the cake was been eaten .
c_13	1		reggie chased the ball .
c_13	1		has fiona eaten sauteed candy canes ?
c_13	1		john said that heidi was obsessed with broccoli .
c_13	1		the boat was sunk by the torpedo .
c_13	1		the boat was sunk by the captain .
c_13	1		i asked what beth bought at the supermarket .
c_13	1		carolyn sent heidi a package .
c_13	1		peter placed the letter in the envelope .
c_13	1		there was a man arriving at the station when i pulled up .
c_13	0	*	it is reluctant that jean will dance .
c_13	1		i want cookies .
c_13	1		she made jerry out to be famous .
c_13	1		i know which guys you 've dated .
c_13	1		the lawyer ca n't prove paul innocent but he can prove della innocent .
c_13	1		bill kissed himself .
c_13	0	*	bill kissed herself .
c_13	1		sally kissed herself .
c_13	0	*	kiss himself .
c_13	1		the robot kissed itself .
c_13	1		she knocked herself on the head with a zucchini .
c_13	0	*	she knocked himself on the head with a zucchini .
c_13	1		the snake flattened itself against the rock .
c_13	1		the joneses think themselves the best family on the block .
c_13	0	*	the joneses think himself the most wealthy guy on the block .
c_13	1		gary and kevin ran themselves into exhaustion .
c_13	0	*	gary and kevin ran himself into exhaustion .
c_13	1		people from tucson think very highly of themselves .
c_13	1		i gave myself the bucket of ice cream .
c_13	0	*	she hit myself with a hammer .
c_13	1		she hit herself with a hammer .
c_13	1		doug blew the building up .
c_13	1		doug blew up the building .
c_13	1		doug blew it up .
c_13	1		doug blew up it .
c_13	0	*	who do you wonder what bought ?
c_13	1		i wonder what fiona bought .
c_13	0	*	toothbrush the is blue .
c_13	1		cheese mice love stinks .
c_13	1		the dancing chorus line of elephants broke my television set .
c_13	1		rosie loves magazine ads .
c_13	1		i think rosie loves magazine ads .
c_13	1		dana doubts that drew believes i think rosie loves magazine ads .
c_13	1		dave left .
c_13	1		dave and alina left .
c_13	1		dave , dan , erin , and alina left .
c_13	1		who do you think that ciaran will question first ?
c_13	1		who do you think ciaran will question first ?
c_13	1		who do you think will question seamus first ?
c_13	0	*	who do you think that will question seamus first ?
c_13	1		i expect soon to see the results .
c_13	1		i expect to see the results soon .
c_13	1		i expect to soon see the results .
c_13	0	*	i expect more than to double my profits .
c_13	0	*	i expect to double more than my profits .
c_13	0	*	i expect to double my profits more than .
c_13	1		i expect to more than double my profits .
c_13	1		who did you see in las vegas ?
c_13	1		you are taller than me .
c_13	0	*	my red is refrigerator .
c_13	0	*	who do you think that saw bill ?
c_13	1		my friends wanted to quickly leave the party .
c_13	0	*	bunnies carrots eat .
c_13	1		george sang to himself .
c_13	0	*	himself sang to george .
c_13	1		betsy loves herself in blue leather .
c_13	1		everyone should be able to defend himself .
c_13	1		everyone should be able to defend herself .
c_13	1		i hope nobody will hurt themselves .
c_13	1		i hope nobody will hurt himself .
c_13	1		do n't hit yourself !
c_13	1		she is dancing .
c_13	1		they are dancing .
c_13	1		the man is dancing .
c_13	1		the men are dancing .
c_13	1		the students met to discuss the project .
c_13	1		zeke cooked and ate the chili .
c_13	1		zeke ate and cooked the chili .
c_13	1		he put the clothes .
c_13	1		he put in the washing machine .
c_13	1		i gave my brother a birthday present .
c_13	1		i gave a birthday present to my brother .
c_13	1		where do you guys live at ?
c_13	1		it is obvious to everybody that tasha likes misha .
c_13	1		the man loved peanut butter cookies .
c_13	1		the puppy loved peanut butter cookies .
c_13	1		the king loved peanut butter cookies .
c_13	0	*	the green loved peanut butter cookies .
c_13	0	*	the in loved peanut butter cookies .
c_13	0	*	the sing loved peanut butter cookies .
c_13	1		john went to the store .
c_13	1		the man went to the store .
c_13	0	*	quickly walks went to the store .
c_13	0	*	to the washroom kissed the blarney stone .
c_13	1		the destruction of the city bothered the mongols .
c_13	1		sincerity is an important quality .
c_13	1		the assassination of the president .
c_13	1		tucson is a great place to live .
c_13	1		gabrielle 's mother is an axe murderer .
c_13	1		hamsters mother attractive offspring .
c_13	1		wendy 's mother country is iceland .
c_13	1		louis said that parts of speech intrigued her .
c_13	0	*	cat ate the spider .
c_13	1		the cat ate the spider .
c_13	1		cats ate the spider .
c_13	1		the cats ate the spider .
c_13	0	*	i ate apple .
c_13	1		i ate the apple .
c_13	1		i ate sugar .
c_13	1		i ate the sugar .
c_13	1		he is filled with sincerity .
c_13	1		i doubt his sincerity .
c_13	1		the dastardly surgeon stole the physician 's lunch .
c_13	1		i asked the question .
c_13	1		i asked if you knew the answer .
c_13	1		i hit the ball .
c_13	1		i spared him the trouble .
c_13	0	*	i put the box the book .
c_13	1		i put the book in the box .
c_13	1		i gave the box to leah .
c_13	1		i gave leah the box .
c_13	1		i told daniel the story .
c_13	1		i told daniel that the exam was cancelled .
c_13	1		i told the story to daniel .
c_13	1		the canadian government uses a parliamentary system of democracy .
c_13	1		the canadian bought himself a barbecue .
c_13	1		the prudish linguist did n't enjoy looking at the internet .
c_13	1		we keep those censored copies of the book hidden to protect the sensibilities of the prudish .
c_13	1		susan bought some flowers for her mother .
c_13	1		susan bought some flowers for her birthday .
c_13	0	*	susan bought her birthday some flowers .
c_13	1		i gave blood .
c_13	1		i do n't give a darn .
c_13	1		andy gives freely of his time .
c_13	1		dan gave his life .
c_13	1		dan gives to charity .
c_13	1		sorry , i gave last week .
c_13	1		the student loved his phonology readings .
c_13	1		i saw these dancers and those musicians smoking something .
c_13	1		i am drinking lemonade and eating a brownie .
c_13	1		we went through the woods and over the bridge .
c_13	1		the man whose car i hit last week sued me .
c_13	1		the big man from ny has often said that he gave peanuts to elephants .
c_13	1		the man killed the king with the knife .
c_13	1		we ate at a really fancy restaurant .
c_13	0	*	we ate at .
c_13	1		big bowls of beans are what i like .
c_13	1		the big boy was kissed by the drooling dog .
c_13	1		the drooling dog kissed the big boy .
c_13	1		john and the man went to the store .
c_13	0	*	john and very blue went to the store .
c_13	1		bruce loved and kelly hated phonology class .
c_13	0	*	the with milk coffee is hot .
c_13	1		the kangaroo hopped over the truck .
c_13	1		i have n't seen this sentence before .
c_13	1		susan will never sing at weddings .
c_13	1		the officer carefully inspected the license .
c_13	1		every cat always knows the location of her favorite catnip toy .
c_13	1		the cat put her catnip toy on the plastic mat .
c_13	1		the very young child walked from school to the store .
c_13	1		john paid a dollar for a head of lettuce .
c_13	1		teenagers drive rather quickly .
c_13	1		a clever magician with the right equipment can fool the audience easily .
c_13	1		the police might plant the drugs in the apartment .
c_13	1		those olympic hopefuls should practice diligently daily .
c_13	1		the latest research on dieting always warns people about the dangers of too much cholesterol .
c_13	1		that annoying faucet was dripping constantly for months .
c_13	1		marian wonders if the package from boston will ever arrive .
c_13	1		i said that bonny should do some dances from the middle east .
c_13	1		that dan smokes in the office really bothers alina .
c_13	1		the belief that syntactic theory reveals the inner structure of sentences emboldened the already much too cocky professor .
c_13	1		i bought the parrot in the store .
c_13	1		i put the milk in the fridge .
c_13	1		i mailed the sweater to mary .
c_13	1		i knew the man with the brown hair .
c_13	1		john said mary went to the store quickly .
c_13	1		i discovered an old english poem .
c_13	1		susanne gave the minivan to george .
c_13	1		clyde got a passionate love letter from stacy .
c_13	1		he blew out the candle .
c_13	1		he turned off the light .
c_13	1		he blew up the building .
c_13	1		he rode out the storm .
c_13	0	*	shannon kissed quietly the kitten .
c_13	1		shannon left quietly every day .
c_13	1		juliet says that romeo lies to his parents a lot .
c_13	1		the puppy licked the kitten 's face .
c_13	1		it is raining .
c_13	1		fred feels fine .
c_13	1		that bill 's breath smells of onions bothers erin .
c_13	1		susan kissed the clown 's nose .
c_13	1		cedric danced a jolly jig .
c_13	1		dale said that the lawn was overgrown .
c_13	1		gilgamesh cut the steak with a knife .
c_13	1		we drove all the way to buenos aires .
c_13	1		john tagged lewis with a regulation baseball on tuesday .
c_13	1		the big man from new york loves bagels with cream cheese .
c_13	1		susan rode a bright blue train from new york .
c_13	1		the plucky platypus kicked a can of soup from new york to tucson .
c_13	1		john said martha sang the aria with gusto .
c_13	1		martha said john sang the aria from la bohème .
c_13	1		the book of poems with the bright red cover stinks .
c_13	1		louis hinted mary stole the purse deftly .
c_13	1		the extremely tired students hated syntactic trees with a passion .
c_13	1		many soldiers have claimed bottled water satisfies thirst best .
c_13	1		networking helps you grow your business .
c_13	1		i did n't read a single book the whole time i was in the library .
c_13	1		i did not have a red cent .
c_13	1		felicia wrote a fine paper on zapotec .
c_13	1		heidi hit herself on the head with a zucchini .
c_13	0	*	herself hit heidi on the head with a zucchini .
c_13	1		heidi believes any description of herself .
c_13	1		john knew that there would be a picture of himself hanging in the post .
c_13	1		although he loves marshmallows , john is not a big fan of chocolate .
c_13	1		his yearbook picture gives tom the creeps .
c_13	1		marilyn monroe is norma jeane baker .
c_13	1		gene simmons was originally named haim goldberg .
c_13	1		kevin ate spaghetti with a spoon and geordie did so too .
c_13	1		the chef eats beans and serves salads with forks .
c_13	1		i am frightened of tigers .
c_13	1		i am afraid of tigers .
c_13	1		i am fond of circus performers .
c_13	1		i fear tigers .
c_13	1		i like circus performers .
c_13	1		i am afraid of tigers and fond of clowns without exception .
c_13	1		i am frightened of tigers and fond of clowns without exception .
c_13	1		bob is very serious about mary , but less so than paul .
c_13	1		the book of poems with a red cover from blackwell by robert burns takes a very long time to read .
c_13	1		the book of poems with a red cover from blackwell by robert burns takes a very long time to read .
c_13	1		the book of poems from blackwell with a red cover by robert burns takes a very long time to read .
c_13	1		the book of poems from blackwell by robert burns with a red cover takes a very long time to read .
c_13	1		the book of poems by robert burns from blackwell with a red cover takes a very long time to read .
c_13	1		the book of poems by robert burns with a red cover from blackwell takes a very long time to read .
c_13	1		the book of poems with a red cover by robert burns from blackwell takes a very long time to read .
c_13	0	*	the book with a red cover of poems from blackwell by robert burns takes a very long time to read .
c_13	0	*	the book with a red cover from blackwell of poems by robert burns takes a very long time to read .
c_13	0	*	the book with a red cover from blackwell by robert burns of poems takes a very long time to read .
c_13	1		the book of poems with a red cover and with a blue spine takes a very long time to read .
c_13	1		the book of poems and of fiction from blackwell takes a very long time to read .
c_13	0	*	the one of poems with a red cover takes a very long time to read .
c_13	1		i loved the policeman intensely with all my heart .
c_13	0	*	i loved intensely the policeman with all my heart .
c_13	0	*	i loved the policeman the baker intensely with all my heart .
c_13	1		mika loved the policeman intensely and susan did so half heartedly .
c_13	0	*	susan did so the baker .
c_13	1		john fears dogs .
c_13	1		john is afraid of dogs .
c_13	1		two or three books take a very long time to read .
c_13	0	*	two or boring books take a very long time to read .
c_13	1		the red dress with the pink stripes looks good on sandy .
c_13	1		the ugly man from brazil found books of poems in the puddle .
c_13	1		erin never keeps her pencils in the correct drawer .
c_13	1		dan walked to new mexico in the rain last year .
c_13	1		george wrote a volume of poems in latin for jane .
c_13	1		people with boxes of old clothes lined up behind the door of the building with the leaky roof .
c_13	1		that automobile factories abound in michigan worries me greatly .
c_13	1		no one understands that phrase structure rules explain the little understood phenomenon of the infinite length of sentences .
c_13	1		my favorite language is a language with simple morphology and complicated syntax .
c_13	1		ivan got a headache on wednesday from the disgruntled students of phonology from michigan .
c_13	1		the collection of syntax articles with the red cover bores students of syntax in tucson .
c_13	1		the red volume of obscene verse from italy shocked the puritan soul of the minister with the beard quite thoroughly yesterday .
c_13	1		the biggest man in the room said that john danced an irish jig from county kerry to county tipperary on thursday .
c_13	1		a burlap sack of potatoes with mealy skins fell on the professor of linguistics with the terrible taste in t-shirts from the twelfth story .
c_13	1		the bright green filing cabinet was filled to the brim with the most boring articles from a prestigious journal of linguistics with a moderately large readership .
c_13	1		the coat of the panther is dark black .
c_13	1		the roof of the building is leaking .
c_13	1		the hat of the man standing over there impressed me greatly .
c_13	1		the panther 's coat is dark black .
c_13	1		the building 's roof is leaking .
c_13	1		the man standing over there 's hat impressed me greatly .
c_13	0	*	the man 's standing over there hat impressed me greatly .
c_13	0	*	the man standing over there 's the hat impressed me greatly .
c_13	1		the boy ran .
c_13	1		howard is a linguistics student .
c_13	1		peter said that danny danced .
c_13	1		bill wants susan to leave .
c_13	1		peter thinks that cathy loves him .
c_13	1		people selling their stocks caused the crash of 1929 .
c_13	1		for mary to love that boor is a travesty .
c_13	1		i said that mary signed my yearbook .
c_13	1		i want mary to sign my yearbook .
c_13	1		i 've never seen you eat asparagus .
c_13	1		i know you ate asparagus .
c_13	0	*	i 've never seen you ate asparagus .
c_13	0	*	i 've never seen him eats asparagus .
c_13	1		i 've never seen him eat asparagus .
c_13	1		i think that he eats asparagus .
c_13	1		i want to eat asparagus .
c_13	1		i want him to eat asparagus .
c_13	1		i wonder if he eats asparagus .
c_13	1		for him to eat asparagus is a travesty .
c_13	1		i asked for him to eat the asparagus .
c_13	1		i think he will eat asparagus .
c_13	1		fabio asked if claus had run a marathon .
c_13	0	*	fabio asked if had claus run a marathon .
c_13	0	*	fabio asked had if claus run a marathon .
c_13	1		you can lead a horse to water but will it drink ?
c_13	1		he will go .
c_13	1		he goes .
c_13	1		the peanut butter has got moldy .
c_13	1		the swing blasted the golf ball across the green .
c_13	1		that harry loves dancing is evidenced by his shiny tap shoes .
c_13	1		the brazilians pumped the oil across the river .
c_13	1		lenin believes the tsar to be a power hungry dictator .
c_13	1		brezhnev had said for andropov to leave .
c_13	1		yeltsin saw stalin holding the bag .
c_13	1		robert thinks that students should eat asparagus .
c_13	1		robert thinks that student should eat asparagus .
c_13	1		linguistics students like phonetics tutorials .
c_13	1		martha said that bill loved his cheerios in the morning .
c_13	1		eloise wants you to study a new language . assume to = t .
c_13	1		for maurice to quarrel with joel frightened maggie .
c_13	1		no man has ever beaten the centaur .
c_13	0	*	some man has ever beaten the centaur .
c_13	0	*	every man has ever beaten the centaur .
c_13	1		rosemary hates new york .
c_13	0	*	rosemary hates .
c_13	1		jennie smiled .
c_13	0	*	jennie smiled the microwave .
c_13	1		traci gave the whale a lollipop .
c_13	0	*	traci gave the whale .
c_13	0	*	traci gave a lollipop .
c_13	1		ryan hit andrew .
c_13	1		michael accidentally broke the glass .
c_13	1		leah likes cookies .
c_13	1		lorenzo saw the eclipse .
c_13	1		syntax frightens kenny .
c_13	1		alyssa kept her syntax book .
c_13	1		the arrow hit ben .
c_13	1		the psychologist hates phonology .
c_13	1		doug went to chicago .
c_13	1		dave was given the margarita mix .
c_13	1		george gave jessica the book .
c_13	1		daniel received a scolding from hanna .
c_13	1		bob gave steve the syntax assignment .
c_13	1		stacy came directly from linguistics class .
c_13	1		andrew is in tucson 's finest apartment .
c_13	1		chris hacked the computer apart with an axe .
c_13	1		this key will open the door to the linguistics building .
c_13	1		he bought these flowers for aaron .
c_13	1		she cooked matt dinner .
c_13	0	*	john placed the flute .
c_13	1		john put the book on the table .
c_13	1		john put the book on the table with a pair of tongs .
c_13	1		megan loves kevin .
c_13	0	*	megan loves .
c_13	0	*	megan loves jason .
c_13	1		it rained .
c_13	1		it snowed .
c_13	1		it hailed .
c_13	1		that bill loves chocolate is likely .
c_13	1		it is likely that bill likes chocolate .
c_13	1		i put a book on it .
c_13	1		it bit me on the leg .
c_13	1		shannon sent dan an email .
c_13	1		stacy hit a baseball to julia .
c_13	1		jaime danced a jig .
c_13	1		yuko rubbed the pizza with a garlic clove .
c_13	1		it is raining in san francisco .
c_13	1		the stodgy professor left with his teaching assistant .
c_13	1		i played a tune on my ipod .
c_13	1		molly gave calvin a kiss .
c_13	1		mercedes gave a test to the students in the lecture hall .
c_13	1		spot ate a cat treat .
c_13	1		susan ate yesterday at the restaurant .
c_13	1		gwen looked at a fire truck .
c_13	1		michael asked a question .
c_13	1		adam asked if hyacinth likes pineapples .
c_13	1		i feel it is unfortunate that television is so vulgar these days .
c_13	1		that angus hates sushi is mysterious .
c_13	0	*	jennie smiled the sandwich .
c_13	0	*	placed the flute on the table .
c_13	0	*	john placed on the table .
c_13	0	*	john placed the flute the violin on the table .
c_13	0	*	the rock placed the sky with the fork .
c_13	0	*	john placed the flute the table .
c_13	1		john bit the apple .
c_13	1		susan forgave louis .
c_13	1		the jockey rides the horse .
c_13	1		phillip gave the soldier the medal .
c_13	1		the apple was bitten .
c_13	1		louis was forgiven .
c_13	1		the horse was ridden .
c_13	1		the medal was given to the soldier .
c_13	1		the soldier was given the medal .
c_13	1		the apple was bitten by john .
c_13	1		louis was forgiven by susan .
c_13	1		the horse was ridden by the jockey .
c_13	1		the medal was given to the soldier by phillip .
c_13	1		the soldier was given the medal by phillip .
c_13	1		i ate a basket of apples .
c_13	1		i ate .
c_13	1		i think that john likes his beer .
c_13	1		i think john likes his beer .
c_13	0	*	i think for john to like his beer .
c_13	0	*	i think if john likes his beer .
c_13	1		i ordered that john drink his beer .
c_13	1		i ordered john drink his beer .
c_13	0	*	i ordered for john to drink his beer .
