ks08	0	*	to whom do you think it is the book that mary gave ?
ks08	1		it is difficult for me to concentrate on calculus .
ks08	1		for me to concentrate on calculus is difficult .
ks08	1		calculus is difficult for me to concentrate on .
ks08	1		being lovely to look at has its advantages .
ks08	1		letters to grandma are easy to help the children to write .
ks08	1		it was to boston that they decided to take the patient .
ks08	1		it was with a great deal of regret that i vetoed your proposal .
ks08	1		it was tom who spilled beer on this couch .
ks08	1		it is martha whose work critics will praise .
ks08	1		it was john on whom the sheriff placed the blame .
ks08	1		i wondered who it was you saw .
ks08	1		i was wondering in which pocket it was that kim had hidden the jewels .
ks08	0	*	it is on kim on whom sandy relies .
ks08	1		was it for this that we suffered and toiled ?
ks08	1		who was it who interviewed you ?
ks08	1		i believe it to be her father who was primarily responsible .
ks08	1		i believe it to be the switch that is defective .
ks08	1		tom ate what mary offered to him .
ks08	1		i wonder what mary offered to him .
ks08	1		what mary offered to him is unclear .
ks08	0	*	many information was provided .
ks08	0	*	john offers many advice .
ks08	1		the cake that jones got was more delicious than the one that smith got .
ks08	1		we recommend to eat less cake and pastry .
ks08	1		i saw that gas can explode .
ks08	1		he washed her .
ks08	0	*	wash you !
ks08	0	*	they have no in .
ks08	0	*	some my jobs are in jeopardy .
ks08	0	*	it was the policeman met that several young students in the park last night .
ks08	1		did the policeman meet in the park ?
ks08	1		john put old books in the box .
ks08	0	*	the monkeys proud of their leader .
ks08	0	*	john sounded very .
ks08	1		i do n't know if i should agree .
ks08	1		john bought a book on the table .
ks08	1		john called the president a fool .
ks08	1		i forgot how good beer tastes .
ks08	1		this teacher is a genius .
ks08	0	*	a good friend is remained to me by him .
ks08	1		john ate his noodle quietly .
ks08	1		a smith hammered the metal .
ks08	1		sandy removed her ballet shoes .
ks08	1		this week will be a difficult one for us .
ks08	1		benny worked in a shoe factory when he was a student .
ks08	1		everyone hoped that she would sing .
ks08	1		this proved a decisive factor .
ks08	1		the crocodile devoured the doughnut .
ks08	1		john is afraid of bill .
ks08	0	*	john put under the bathtub .
ks08	1		john placed kim behind the garage .
ks08	0	*	kim depends for sandy .
ks08	1		john put the book in the box .
ks08	1		john taught english syntax to new students .
ks08	1		john regards bill as a good friend .
ks08	0	*	kim put in the box .
ks08	1		the chickens seem fond of the farmer .
ks08	1		the rules require that the executives be polite .
ks08	0	*	that fred was unpopular nominated bill .
ks08	1		they were taking a hard look at possible fta .
ks08	0	*	john paid me against the book .
ks08	1		the committee will study the feasibility of setting up a national computer network .
ks08	1		we made them be rude .
ks08	1		after reading the pamphlet , judy threw it into the garbage can .
ks08	0	*	students studying english reads conrad 's heart of darkness while at university .
ks08	1		i read some of the book .
ks08	1		most of the fruit is rotten .
ks08	0	*	neither of students failed .
ks08	0	*	i drank some of water .
ks08	1		it is a golden hair .
ks08	1		the boy in the doorway waved to his father .
ks08	1		that dog is so ferocious , it even tried to bite itself .
ks08	0	*	he washed yourself .
ks08	0	*	john is easy to please kim .
ks08	0	*	there seemed to be intelligent .
ks08	1		john tried to please stephen .
ks08	0	*	we believed john to be a fountain in the park .
ks08	0	*	it tries to leave the country .
ks08	1		john tries to leave the country .
ks08	1		under the bed seems to be a fun place to hide .
ks08	0	*	there is believed to be sheep in the park .
ks08	0	*	i hope to would study in france .
ks08	1		john can kick the ball .
ks08	0	*	john will rain tomorrow .
ks08	0	*	we expect there to will rain .
ks08	1		john was found in the office .
ks08	0	*	did the child be in the school ?
ks08	1		it did not rain .
ks08	1		john wants not to leave the town .
ks08	1		mary likes to tour art galleries , but bill hates to .
ks08	1		they need n't take this exam .
ks08	1		ann may spend her vacation in italy .
ks08	1		they love to play golf , but i do not .
ks08	1		george has spent a lot of money , has n't he ?
ks08	1		as a statesman , scarcely could he do anything worth mentioning .
ks08	1		we never found any of the unicorns .
ks08	1		one of korea 's most famous poets wrote these lines .
ks08	1		somebody apparently struck the unidentified victim during the early morning hours .
ks08	1		the car was driven .
ks08	1		ricky can be relied on .
ks08	1		the bed was slept in .
ks08	0	*	a pound was weighed by the book .
ks08	1		who do you think tom saw ?
ks08	1		he had spent five thousand dollars .
ks08	0	*	fed knows which politician her to vote for .
ks08	1		how did you guess that he fixed the computer ?
ks08	1		the committee knows whose efforts to achieve peace the world should honor .
ks08	0	*	which house does your friend live ?
ks08	1		the baker from whom i bought these bagels left .
ks08	1		i found the place where we can relax .
ks08	0	*	jack is the person with whom jenny fell in love with .
ks08	1		there is a bench to sit on .
ks08	1		i met the man who grows peaches .
ks08	1		which topic did you choose without getting his approval ?
ks08	0	*	which topic did you get bored because mary talked about ?
ks08	1		that is the reason why he resigned .
ks08	1		it bothers me that john coughs .
ks08	1		to please john is easy .
ks08	1		kim is eager to please tom .
ks08	1		that we invaded iraq really bites .
ks08	1		it annoys me that fido barks .
ks08	0	*	who achieved the best result was angela .
ks08	1		it was the peasant girl who got it .
ks08	1		that kind of person is hard to find anyone to look after .
b_82	1		the men all would have been working .
b_82	1		the men would all have been working .
b_82	1		all the men would not have been working .
b_82	1		they said that they would all work on that , and all work on that they did .
b_82	0	*	they said that they would all work on that , and work on that they did all .
b_82	0	*	how difficult to study for the exam it was !
b_82	1		you gave the book to whom ?
b_82	1		max , i really like him .
b_82	1		he began writing poems .
b_82	1		he kept writing poems .
b_82	1		he continued writing poems .
b_82	1		he stopped writing poems .
b_82	1		the men would have all been working .
b_82	1		the men would have been all working .
b_82	1		would the men each have been working ?
b_82	0	*	would each the men have been working ?
b_82	1		the men would not enjoy that .
b_82	0	*	would not the men enjoy that ?
b_82	1		would the men not enjoy that ?
b_82	0	*	the men would all not have been working .
b_82	1		the men all would not have been working .
b_82	1		the men would not have all been working .
b_82	1		the men would not all have been working .
b_82	1		the men would not have been all working .
b_82	1		that john is a fool is obvious .
b_82	1		it is obvious that john is a fool .
b_82	0	*	john believes that fred likes steak that joe likes pizza .
b_82	1		john whined that he was hungry .
b_82	0	*	that he was hungry was whined by john .
b_82	1		john is certain that the mets will win .
b_82	1		that he has blood on his hands proves that john is the murderer .
b_82	0	*	it proves that john is the murderer that he has blood on his hands .
b_82	1		to please john would be difficult .
b_82	1		it would be difficult to please john .
b_82	1		it is believed to be obvious by everyone that fred is crazy .
b_82	0	*	john is believed to be certain by everyone that fred is crazy .
b_82	1		it disturbed him that people did n't like fred .
b_82	1		it was believed to have disturbed him that people did n't like fred .
b_82	0	*	how easy to please john is it ?
b_82	0	*	how difficult to study for the exam was it ?
b_82	0	*	how hard to read the book was it ?
b_82	0	*	how easy to tease john it is !
b_82	0	*	how hard to read the book it was !
b_82	1		how certain that the mets will win are you ?
b_82	1		how likely to win is he ?
b_82	1		this book i enjoyed .
b_82	0	*	to whom the book did you give .
b_82	0	*	the book to whom did you give .
b_82	1		he 's a man to whom liberty we could never grant .
b_82	1		it 's obvious that mary , he ca n't stand .
b_82	1		i think that the trolls will take the shepherd tomorrow .
b_82	1		as for max , i really like him .
b_82	0	*	he 's a man to whom as for liberty , we could never grant it .
b_82	0	*	he 's a man to whom liberty , we could never grant it .
b_82	1		john would like that because he 's such a nice guy .
b_82	1		john , because he 's such a nice guy , would like that .
b_82	1		because he 's such a nice guy , john would like that .
b_82	1		john would , because he 's such a nice guy , like that .
b_82	1		because he 's such a nice guy , what would john like ?
b_82	1		it 's obvious that , although he 's a nice guy , john is n't too bright .
b_82	0	*	john ate after getting home the steak .
b_82	1		i gave mary a book .
b_82	1		i considered fred crazy .
b_82	1		i put the book on the table .
b_82	1		i worded the telegram tersely .
b_82	0	*	i considered fred after the party crazy .
b_82	0	*	1 put the book after the party on the table .
b_82	0	*	i worded the telegram after the party tersely .
b_82	0	*	because she 's so pleasant , mary i really like her .
b_82	1		because she 's so pleasant , mary i really like .
b_82	1		though he may seem intelligent , he does not seem deep .
b_82	1		intelligent though he may seem , he does not seem deep .
b_82	1		though i may love her , that wo n't affect the grade .
b_82	1		love her though i may , that wo n't affect the grade .
b_82	0	*	handsome though i believe the claim that tom is , i still wo n't date him .
b_82	0	*	handsome though they told me that tom is , i still wo n't date him .
b_82	0	*	handsome though my friends suggested that mary thinks that tom is , i still wo n't date him .
b_82	1		hate those who criticize carter though he may , it does n't matter .
b_82	1		would john hate that ?
b_82	1		would john hate that !
b_82	0	*	will , after john comes home , sally take a shower ?
b_82	1		will sally , after john comes home , take a shower ?
b_82	1		after john comes home , will sally take a shower ?
b_82	1		i would prefer that he not have finished .
b_82	0	*	i would prefer that he have not finished .
b_82	1		he has not finished .
b_82	1		he is not finishing .
b_82	1		he would not finish .
b_82	1		he does not finish .
b_82	0	*	those people will , after the party , not come home .
b_82	1		those people , after the party , will not come home .
b_82	0	*	that he was hungry , john whined .
b_82	0	*	1 gave mary after the party a book .
b_82	0	*	because she 's so pleasant , as for mary i really like her .
b_82	1		though he may hate those that criticize carter , it does n't matter .
b_82	1		with no job would john be happy .
w_80	1		john ate the meat raw .
w_80	1		john ate the meat nude .
w_80	1		john made bill mad .
w_80	1		john loaded the hay into the wagon green .
w_80	0	*	john loaded the hay into the wagon full .
w_80	1		i presented it to john dead .
w_80	1		john thinks of bill as silly .
w_80	1		bill was thought of as silly .
w_80	1		who do you think of as silly ?
w_80	0	*	of whom do you think as silly ?
w_80	1		john made bill sick .
w_80	1		john left nude .
w_80	1		john became sick .
w_80	1		john strikes bill as stupid .
w_80	1		john arrived dead .
w_80	1		john persuaded bill to leave .
w_80	1		john died waiting for a bus .
w_80	1		to leave would be john 's pleasure .
w_80	1		for john to leave would be my pleasure .
w_80	1		john died nude .
w_80	1		john promised bill to be examined .
w_80	1		john was promised .
w_80	1		john was promised the book .
w_80	0	*	good cooks are made by them .
w_80	1		what to do is a mystery .
w_80	1		what to do is a mystery to john .
w_80	1		john has something to do .
w_80	0	*	1 wondered what bill to do .
w_80	1		i am counting on you for mary to get there on time .
w_80	1		john wants to win .
w_80	1		john wants for bill to win .
w_80	1		i would hate to leave .
w_80	1		i arranged to leave .
w_80	1		i arranged for pete to leave .
w_80	1		it was arranged to have dinner at 6 .
w_80	1		it was preferred to have dinner at 6 .
w_80	1		it was decided to have dinner at 6 .
w_80	1		it was decided by the committee to have dinner at 6 .
w_80	1		it is important to john to leave .
w_80	1		i want to leave .
w_80	1		to leave would be my pleasure .
w_80	1		it is important to me to leave .
w_80	1		i bought a book to read .
w_80	0	*	john promised mary to leave together .
w_80	1		i want to meet at 6 .
w_80	0	*	i will try to meet at 6 .
w_80	0	*	john 's arrival dead surprised me .
w_80	0	*	the arrival of john dead surprised me .
w_80	1		john 's attempt to leave surprised me .
w_80	1		any attempt to leave surprises me .
w_80	1		john left orders for bill not to leave .
w_80	1		it is clear that he is here .
w_80	0	*	john 's reluctance is clear that he is here .
w_80	1		it is upsetting , the way he goes on that he wo n't help .
w_80	1		john considers it clear that bill is here .
w_80	1		john saw to it that bill had a good time .
w_80	0	*	john stated it succinctly that he was leaving .
w_80	1		it was felt that bill was tardy .
w_80	0	*	john 's reluctance seems .
w_80	1		john seems t to be here .
w_80	1		to leave is to give up .
w_80	0	*	it proves that john was lying that he left town .
w_80	1		many people said they were sick who were n't .
w_80	1		it 's that john wo n't help that bothers me .
w_80	0	*	it is believed to be the problem that he is here .
w_80	1		that john is here seems to be believed to be the problem .
w_80	0	*	it seems to be believed to be the problem that john is here .
w_80	0	*	it is believed to have been shown that movement is cyclic , but it is n't that vp deletion is .
w_80	1		it is believed that movement is cyclic , but it is n't that vp deletion is .
w_80	1		it is believed to be true by everyone that movement is cyclic .
w_80	1		it was john that i saw .
w_80	1		i bought it dead .
w_80	1		i gave it to pete dead .
w_80	1		i wrote a letter to bill to read .
w_80	0	*	i wrote to bill to read .
w_80	1		it was bought to read .
w_80	1		the book was bought by bill to read .
w_80	1		i bought it for bill to read .
w_80	1		i bought it to hold books .
w_80	1		john is proud that there are pictures of himself here .
w_80	1		john thinks that it is appropriate for there to be a picture of himself in the corridor .
w_80	0	*	john thinks it would upset himself to die .
w_80	1		john made bill be mad at himself .
w_80	0	*	john knew that the book for himself to read was parnell .
w_80	1		john knew that for himself to be there would cause problems .
w_80	1		a picture of himself frightened john .
w_80	1		john is sad .
w_80	1		john loaded the wagon full with hay .
w_80	0	*	john loaded the wagon with hay green .
w_80	0	*	i presented john with it dead .
w_80	1		of whom are you thinking ?
w_80	1		john became rich .
w_80	1		i gave john gold apples .
w_80	1		how silly is bill considered ?
w_80	1		how mad was bill made ?
w_80	1		john is sick .
w_80	1		john left singing .
w_80	1		john is near larry .
w_80	1		john gave bill the dog dead .
w_80	0	*	bill was struck by john as stupid .
w_80	0	*	john was struck as sick .
w_80	1		john was struck by bill 's idiocy .
w_80	1		john promised bill to leave .
w_80	1		john tried to leave .
w_80	1		to leave would be a pleasure .
w_80	0	*	john was struck by bill as pompous .
w_80	0	*	john was promised by bill to leave .
w_80	1		they make good cooks .
w_80	1		there is nothing to do .
w_80	1		john has something for bill to do .
w_80	1		i am counting on bill to incriminate himself .
w_80	1		on whom are you counting to incriminate himself ?
w_80	1		i am counting on bill to get there on time .
w_80	1		i would prefer to leave .
w_80	1		i would hate for john to leave .
w_80	1		i would prefer for john to leave .
w_80	0	*	it was hated for john to leave .
w_80	0	*	john decided for bill to get the prize .
w_80	0	*	john decided bill to get the prize .
w_80	1		to die is no fun .
w_80	1		john wants to leave .
w_80	1		john counted on bill to get there on time .
w_80	1		i bought bill a book to read .
w_80	1		john told mary that it would be important to leave early .
w_80	1		john told mary that it was important to fred to leave early .
w_80	1		john , told mary that it would be appropriate to leave together .
w_80	0	*	the election of john president surprised me .
w_80	1		john 's arriving dead surprised me .
w_80	1		the attempt by john to leave surprised me .
w_80	1		john left orders to follow pete .
w_80	1		john left us orders to follow pete .
w_80	1		john left orders not to be disturbed .
w_80	1		that he is here is clear .
w_80	1		it is a problem that he is here .
w_80	1		it bothers me that he is here .
w_80	1		john regretted it that bill had a good time .
w_80	0	*	john believes it that bill is here .
w_80	0	*	john believes it sincerely that bill is here .
w_80	0	*	john is aware of it that bill is here .
w_80	0	*	john felt it that bill was tardy .
w_80	0	*	john believed it that bill was tardy .
w_80	1		it was believed that bill was tardy .
w_80	0	*	that john is reluctant seems .
w_80	0	*	it is the problem that he is here .
w_80	1		that he is here is the problem .
w_80	1		the problem we are discussing is george .
w_80	0	*	it is to give up to leave .
w_80	1		it would prove our theory to be untenable for carrots to be vegetables .
w_80	0	*	it was believed to be illegal by them to do that .
w_80	1		john grudgingly accepted judgments of his incompetence as an auto mechanic .
w_80	1		it was to john that i gave the book .
w_80	1		i bought it to read .
w_80	1		i bought it to give to pete .
w_80	1		i gave it to pete to take to the fair .
w_80	0	*	i gave pete the book to impress .
w_80	1		i wrote to bill .
w_80	1		i presented it to bill to read .
w_80	0	*	i presented bill with it to read .
w_80	1		i gave a book to bill to read .
w_80	1		john thinks it would upset himself to die .
w_80	1		john made bill mad at himself .
w_80	1		john made bill master of himself .
w_80	1		the correspondence school made bill a good typist .
w_80	1		the correspondence school sent bill a good typist .
w_80	1		john considers bill silly .
w_80	1		john considers bill to be silly .
w_80	0	*	john bought a dog for himself to play with .
w_80	1		john arranged for himself to get the prize .
w_80	1		john talked to bill about himself .
kl93	0	*	almost some lawyer could answer that question .
kl93	1		a large dog gives live birth .
kl93	1		is there something i can do for you ?
kl93	1		i expected that we would not have any potatoes .
kl93	0	*	all but at most three boys saw anything .
kl93	1		i 'm surprised he bought a honda .
kl93	1		take any apple .
kl93	1		i do n't have any potatoes .
kl93	0	*	i have any potatoes .
kl93	1		at most three girls saw anything .
kl93	0	*	at least three girls saw anything .
kl93	1		every girl who saw anything was happy .
kl93	0	*	some girl who saw anything was happy .
kl93	1		any owl hunts mice .
kl93	1		any lawyer could tell you that .
kl93	1		i would dance with anybody .
kl93	1		almost every lawyer could answer that question .
kl93	1		almost no lawyer could answer that question .
kl93	1		almost any lawyer could answer that question .
kl93	0	*	i do n't have almost any potatoes .
kl93	1		i would dance with mary or sue .
kl93	1		mary or sue could tell you that .
kl93	1		do you have dry socks ? claim .
kl93	1		perhaps some dry socks would help ?
kl93	1		an owl hunts mice .
kl93	1		generics allow exceptions .
kl93	1		a poodle gives live birth .
kl93	1		every poodle gives live birth .
kl93	1		i do n't have potatoes .
kl93	1		every man who has matches is happy .
kl93	1		every man who has any matches is happy .
kl93	1		could we make some french fries ?
kl93	1		why do n't we make some french fries ?
kl93	1		are you prepared for school tomorrow ?
kl93	1		and then all the owls go on a mice hunt .
kl93	1		if you take a dry match and strike it , it lights .
kl93	1		at most three teachers assigned homework .
kl93	1		at most three teachers assigned any homework .
kl93	1		every student who handed in some homework will get a prize .
kl93	1		every student who handed in any homework will get a prize .
kl93	1		before you make plans , consult the secretary .
kl93	1		before you make any plans , consult the secretary .
kl93	1		is there anything i can do for you ?
kl93	1		a professional dancer would be able to do it .
kl93	1		any professional dancer would be able to do it .
kl93	1		we do n't have potatoes , or at least not enough .
kl93	1		every man who has any matches is happy . happy .
kl93	0	*	every boy has any potatoes .
kl93	0	*	it 's not the case that every boy has any potatoes .
kl93	1		i 'm surprised we had any potatoes .
kl93	1		at most three boys did n't see anything .
kl93	0	*	even sue said anything .
kl93	1		sue was the most likely not to say anything .
kl93	1		sue said something although she was the most likely not to say anything .
kl93	1		cows fly more often than john visits any relatives .
kl93	0	*	each candidate who has any interest in semantics will be admit ted to the department .
kl93	1		every child should have a daily glass of milk .
kl93	1		each child should have a daily glass of milk .
kl93	1		i 'm surprised that he ever said anything .
kl93	1		i 'm sorry that he ever said anything .
kl93	0	*	i 'm glad that i ever met him .
kl93	0	*	i 'm sure that i ever met him .
kl93	1		i 'm surprised he bought a car .
kl93	1		but these tickets are terrible !
kl93	1		i was surprised that he stole the watch , in as far as that was a daring thing to do .
kl93	1		given my high opinion on his moral character , i was surprised that he stole the watch .
kl93	1		were you surprised that he stole the watch ?
kl93	1		i 'm sorry that anybody hates me .
kl93	1		i want for nobody to hate me .
kl93	1		i 'm glad he bought a car .
kl93	1		i 'm sorry he bought a car .
kl93	1		he bought a honda .
kl93	0	*	i 'm glad i saw anybody .
kl93	1		i 'm glad anybody likes me !
kl93	1		could n't you get any tickets better than this ?
kl93	1		it 's fine that he paid and apologized , but i do n't really care about his gratitude , or the money , or anything .
kl93	0	*	i 'm sure we got any tickets !
kl93	1		i 'm sure he speaks to me !
kl93	1		i 'm glad a linguist likes me .
kl93	1		i did n't help him because i have any sympathy for urban guerillas .
kl93	0	*	it is n't because sue said anything bad about me that i 'm angry , although she did say some bad things about me .
kl93	1		i do n't have any sympathy for urban guerillas .
kl93	0	*	almost an owl hunts mice .
kl93	0	*	absolutely an owl hunts mice .
kl93	1		almost any owl hunts mice .
kl93	1		absolutely any owl hunts mice .
kl93	1		a sick owl does n't hunt mice .
kl93	1		each candidate who has interest in semantics will be admitted to the department .
kl93	1		each author whose contribution is written in any language other than english will provide a summary in english .
kl93	1		i 'm sure we even got these tickets !
kl93	1		i 'm even sure we got these tickets !
kl93	1		it 's not because i have any sympathy for urban guerillas that i helped him .
kl93	1		it is n't because sue said anything bad about me that i 'm angry .
clc95	1		they claimed they had settled on something , but it was n't clear what .
clc95	1		somebody just left - guess who just left .
clc95	1		this opera was written in the 19th century , but we 're not sure by whom .
clc95	1		he 's going to give us one old problem for the test , but which problem is n't clear .
clc95	1		she 's reading something . i ca n't imagine what .
clc95	1		if sam was going somewhere , sally would know where .
clc95	1		they 're going to serve the guests , but it 's unclear what .
clc95	1		joan ate dinner but i do n't know with whom .
clc95	1		i served leek soup .
clc95	1		i served my guests leek soup .
clc95	1		she served the soup , but i do n't know to whom .
clc95	0	*	she served the soup , but i do n't know who .
clc95	1		she served the students , but i do n't know what .
clc95	1		she was reading , but i could n't make out what .
clc95	0	*	the ship sank with a torpedo .
clc95	0	*	they noticed the painting for an hour .
clc95	0	*	she knew french , but i do n't know for whom .
clc95	1		since jill said joe had invited sue , we did n't have to ask who .
clc95	1		because we suspected joe had given it to max , we then asked who he had given it to .
clc95	1		she did n't talk to one student ; i wonder who .
clc95	1		the newspaper has reported that they are about to appoint someone , but i ca n't remember who .
clc95	1		most columnists claim that a senior white house official has been briefing them .
clc95	1		most columnists claim that a senior white house official has been briefing them , but none will reveal which one has been briefing them .
clc95	1		we know how many papers this reviewer has read , but we do n't know which ones .
clc95	1		joan said she talked to some students but i do n't know who .
clc95	1		john read three of the books but i do n't know which ones .
clc95	1		we should put them in the dining room but it 's not clear where .
clc95	1		we should put them somewhere in the dining room but it 's not clear where .
clc95	1		they were going to meet sometime on sunday , but the faculty did n't know when they were going to meet .
clc95	1		i do n't know who the students john likes are .
clc95	1		he announced he had eaten the asparagus , but we did n't know which asparagus .
clc95	1		she read until midnight , and i wonder what she read .
clc95	1		they were eating , and i wonder what they were eating .
clc95	0	*	she found out , and i wonder what .
clc95	0	*	they applied yesterday , and i wonder what for .
clc95	1		john is working on war and peace but i do n't know which chapter .
