ks08	0	*	could you turn off the fire and on the light ?
ks08	0	*	i know the truth and that you are innocent .
ks08	1		john refused the offer proudly .
ks08	1		i consider john the best candidate .
ks08	1		i saw him leaving the main building .
ks08	1		he took john to the school by the park .
ks08	1		john sang a song and danced to the music .
ks08	1		john wants to study linguistics in near future .
ks08	1		they told angelica to arrive early for the award .
ks08	1		that louise had abandoned the project surprised everyone .
ks08	1		i know you like the back of my hand .
ks08	1		time flies like an arrow .
ks08	1		i need to have that report on our web page by tomorrow .
ks08	1		the monkey scratched a boy on monday .
ks08	1		john tagged the monkey in the forest .
ks08	1		the monkey was tagged in the forest by john .
ks08	1		the cat devoured the rat .
ks08	1		the rat devoured the cat .
ks08	1		this car stinks .
ks08	1		it rains .
ks08	1		the committee disliked her proposal .
ks08	1		these books disappoint me .
ks08	1		our neighbor takes his children to school in his car .
ks08	0	*	our neighbor take his children to school in his car .
ks08	1		the book , including all the chapters in the first section , is very interesting .
ks08	0	*	the book , including all the chapters in the first section , are very interesting .
ks08	1		the effectiveness of teaching and learning depends on several factors .
ks08	0	*	the effectiveness of teaching and learning depend on several factors .
ks08	1		the tornadoes that tear through this county every spring are more than just a nuisance .
ks08	0	*	the tornadoes that tear through this county every spring is more than just a nuisance .
ks08	1		the lady singing with a boy is a genius , is n't he ?
ks08	0	*	the lady singing with a boy is a genius , is n't she ?
ks08	1		with their teacher , the kids have arrived safely , have n't they ?
ks08	0	*	with their teacher , the kids have arrived safely , has n't he ?
ks08	1		the kids have arrived safely .
ks08	1		it could be more detrimental .
ks08	1		is this teacher a genius ?
ks08	1		have the kids arrived safely ?
ks08	1		could it be more detrimental ?
ks08	1		the kids in our class have arrived safely .
ks08	0	*	have in our class the kids arrived safely ?
ks08	1		his girlfriend bought this computer .
ks08	1		thunder frightens the dog .
ks08	1		the dog fears thunder .
ks08	1		his girlfriend bought this computer for him .
ks08	1		the child broke the teapot by accident .
ks08	1		this computer was bought for him by his girlfriend .
ks08	1		the teapot was broken by the child by accident .
ks08	1		this item belongs to the student .
ks08	0	*	the student is belonged to by this item .
ks08	1		he remained a good friend to me .
ks08	0	*	a good friend is remained to me .
ks08	1		john gave the boys the cds .
ks08	1		my mother baked me a birthday cake .
ks08	1		she was sent a review copy of the book by the publisher .
ks08	1		she was sent a review copy of the book .
ks08	1		john gave the cds to the boys .
ks08	1		the publisher sent a review copy of the book to her .
ks08	1		my mother baked a cake for me .
ks08	1		the cds were given to the boys by john .
ks08	1		a review copy of the book was sent to her by the publisher .
ks08	1		this nice cake was baked for me by my mother .
ks08	1		this is my ultimate goal .
ks08	1		michelle became an architect .
ks08	1		they elected graham chairman .
ks08	0	*	chairman was elected graham .
ks08	0	*	the best writer was considered andrew .
ks08	1		john made kim a great doll .
ks08	1		the situation became terrible .
ks08	1		this map is what he wants .
ks08	1		the message was that you should come on time .
ks08	1		i made kim angry .
ks08	1		i consider him immoral .
ks08	1		i regard andrew as the best writer .
ks08	1		they spoil their kids rotten .
ks08	1		john put books in the box .
ks08	1		john talked to bill about the exam .
ks08	1		she reminded him of the last time they met .
ks08	1		they would inform mary of any success they have made .
ks08	1		john gave a book to the student .
ks08	1		john bought a book for the student .
ks08	1		the bus stopped suddenly .
ks08	1		shakespeare wrote his plays a long time ago .
ks08	1		they went to the theater in london .
ks08	1		he failed chemistry because he ca n't understand it .
ks08	0	*	john gave tom a book a record .
ks08	1		i saw this film several times last year during the summer .
ks08	1		my uncle visited today .
ks08	0	*	today was visited by my uncle .
ks08	1		the termites destroyed the sand castle .
ks08	1		being honest is not an easy task .
ks08	1		that john passed surprised her .
ks08	1		to finish this work on time is almost unexpected .
ks08	1		under the bed is a safe place to hide .
ks08	1		i sent a surprise present to john .
ks08	1		they wondered what she did yesterday .
ks08	1		they believed that everybody would pass the test .
ks08	1		are you going on holiday before or after easter ? i prefer after easter .
ks08	1		that john passed surprised her , did n't it ?
ks08	1		that the march should go ahead and that it should be cancelled have been argued by different people at different times .
ks08	0	*	that the march should go ahead and that it should be cancelled has been argued by different people at different times .
ks08	1		to finish it on time made quite a statement , did n't it ?
ks08	1		to delay the march and to go ahead with it have been argued by different people at different times .
ks08	0	*	to delay the march and to go ahead with it has been argued by different people at different times .
ks08	1		the little cat devoured a mouse last night .
ks08	1		john left very early .
ks08	1		john studied hard to pass the exam .
ks08	1		she disappeared when the main party arrived .
ks08	1		a boy hit the ball .
ks08	1		the students felt comfortable in the class .
ks08	1		john gave a book to the students .
ks08	1		john died last night .
ks08	1		john bought a lot of books for his sons .
ks08	1		john promised bill to leave tomorrow morning .
ks08	1		john deprived his sons of game cards .
ks08	1		mary received an award from the department .
ks08	1		john told the rumor to his friend .
ks08	1		john put his books in the attic .
ks08	1		the government kept all the money .
ks08	1		john hit the ball with a bat .
ks08	1		john wiped the window with a towel .
ks08	1		the cat chased pat the mouse .
ks08	1		the mouse was chased by the cat .
ks08	1		there still remains an issue to be solved .
ks08	1		there lived a man with his grandson .
ks08	1		there arrived a tall , red haired and incredibly well dressed man .
ks08	0	*	there sang a man with a pipe .
ks08	0	*	there dances a man with an umbrella .
ks08	1		john resembles his mother .
ks08	1		a is similar to b .
ks08	1		john runs into the house .
ks08	1		mary looked at the sky .
ks08	1		the school awarded a few of the girls in miss kim 's class scholarships .
ks08	1		she was the nicest teacher in the senior school .
ks08	1		they elected him america 's 31st president .
ks08	1		the next morning we set out for seoul .
ks08	1		doing syntax is not easy .
ks08	1		he saw the man with the stick .
ks08	1		they parted the best of friends .
ks08	1		in the summer we always go to france .
ks08	1		last year i saw this film several times .
ks08	1		he baked tom the bread last night .
ks08	1		that they have completed the course is amazing .
ks08	1		the teacher made students happy .
ks08	1		we reminded him of the agreement .
ks08	1		in the garden stands a statue .
ks08	0	*	in the garden stand a statue .
ks08	1		among the guests was sitting my friend louise .
ks08	0	*	among the guests were sitting my friend louise .
ks08	1		this proved my hypothesis .
ks08	1		the students all enjoyed that summer .
ks08	1		the students all worked that summer .
ks08	1		the scientist made her a robot .
ks08	1		the students called me a teacher .
ks08	1		a big green insect flew into the soup .
ks08	1		john 's mother sent a letter to mary .
ks08	1		we placed the cheese in the refrigerator .
ks08	1		frank threw himself into the sofa .
ks08	1		the ice melted .
ks08	1		the vacuum cleaner frightens the child .
ks08	1		scientists found that the birds sang well in the evenings , but performed badly in the mornings .
ks08	0	*	john put his gold .
ks08	0	*	john put his gold safe .
ks08	0	*	john put his gold to be under the bathtub .
ks08	1		john put his gold under the bathtub .
ks08	1		this is the box in which john put his gold .
ks08	1		this is the gold that john put under the bathtub .
ks08	0	*	the king kept put his gold under the bathtub .
ks08	1		the king kept putting his gold under the bathtub .
ks08	1		the defendant denied the accusation .
ks08	0	*	the defendant denied .
ks08	1		the teacher handed the student a book .
ks08	0	*	the teacher handed the student .
ks08	1		they want to leave the meeting .
ks08	0	*	they eager to leave the meeting .
ks08	1		the senators know that the president is telling a lie .
ks08	0	*	the senators certain that the president is telling a lie .
ks08	1		be eager to leave the meeting .
ks08	0	*	the senators to be certain that the president is telling a lie .
ks08	0	*	the senators be certain that the president is telling a lie .
ks08	1		tom offered advice to his students in his office .
ks08	1		tom offered advice to his students with love .
ks08	1		john kept him behind the garage .
ks08	0	*	john stayed kim behind the garage .
ks08	0	*	john placed him busy .
ks08	1		john kept him busy .
ks08	0	*	john stayed him busy .
ks08	0	*	john placed behind the counter .
ks08	0	*	john kept behind the counter .
ks08	1		john stayed behind the counter .
ks08	1		john deposited some money in the bank .
ks08	1		john deposited some money in the bank on friday .
ks08	0	*	the un blamed global warming on humans on natural causes .
ks08	1		kim and sandy met in seoul in the lobby of the lotte hotel in march .
ks08	1		john deposited some money in the checking account and mary did the same thing .
ks08	1		john deposited some money in the checking account on friday and mary did the same thing .
ks08	1		john deposited some money in the checking account on friday and mary did the same thing on monday .
ks08	0	*	john deposited some money in the checking account and mary did the same thing in the savings account .
ks08	0	*	john gave a present to the student and mary did the same thing to the teacher .
ks08	0	*	john locked fido in the garage and mary did so in the room .
ks08	0	*	john ate a carrot and mary did so a radish .
ks08	1		kim jogs on the hill .
ks08	1		kim jogs under the hill .
ks08	1		kim jogs over the hill .
ks08	1		kim depends .
ks08	1		kim relies on sandy .
ks08	1		kim depends on sandy .
ks08	0	*	kim depends at sandy .
ks08	1		john met a student in the park .
ks08	0	*	john met in the park a student .
ks08	0	*	the problem disappeared the accusation .
ks08	1		the problem disappeared .
ks08	0	*	the boy gave the book .
ks08	1		the boy gave the baby the book .
ks08	1		the bird devours the worm .
ks08	1		the birds devour the worm .
ks08	1		every photo of max and sketch by his students appeared in the magazine .
ks08	1		no photo of max and sketch by his students appeared in the magazine .
ks08	0	*	sketch by his students appeared in the magazine .
ks08	1		the present king of country music is more popular than the last one .
ks08	0	*	the king of rock and roll is more popular than the one of country music .
ks08	1		which student were you talking about ?
ks08	0	*	john put in the box .
ks08	0	*	in the box put john the book .
ks08	1		the election results surprised everybody .
ks08	1		that he won the election surprised everybody .
ks08	1		john disappeared .
ks08	0	*	john disappeared bill .
ks08	1		john coughed .
ks08	0	*	john coughed the money .
ks08	1		the president looked weary .
ks08	1		the teacher became tired of the students .
ks08	1		the lasagna tasted delicious .
ks08	1		john remained somewhat calm .
ks08	1		the jury seemed ready to leave .
ks08	1		john became a success .
ks08	1		john seemed a fool .
ks08	1		john remained a student .
ks08	1		john saw fred .
ks08	1		alice typed the letter .
ks08	1		clinton supported the health care bill .
ks08	1		raccoons destroyed the garden .
ks08	1		the school board leader asked the students a question .
ks08	1		john taught new students english syntax .
ks08	1		the school board leader asked a question of the students .
ks08	1		the sexual revolution makes some people uncomfortable .
ks08	1		ad agencies call young people generation x-ers .
ks08	1		historians believe fdr to be our most effective president .
ks08	0	*	john carried to the door .
ks08	1		tom locked fido in the garage .
ks08	1		tom bathed fido in the garage .
ks08	1		tom placed it under the table .
ks08	1		tom played it under the table .
ks08	1		i wonder if you will come back tomorrow .
ks08	1		you would have a reply if you come back tomorrow .
ks08	1		tom hid the manuscript in the cupboard .
ks08	1		fred hired sharon to change the oil .
ks08	1		they pushed the prisoners into the truck .
ks08	1		frank hopes to persuade harry to make the cook wash the dishes .
ks08	1		george mailed the attorney his photograph of the accident .
ks08	1		tom keeps asking karen 's sister to buy the car .
ks08	1		jane left the book on the table .
ks08	1		we have not confirmed whether the flight had been booked .
ks08	1		we saw him beaten by the champion .
ks08	1		they confined his remarks to the matter under discussion .
ks08	0	*	oliver ascribed his longevity there .
ks08	0	*	oliver mentioned charles the problem .
ks08	0	*	oliver fined ten pounds to the prisoner .
ks08	0	*	oliver drove me a lunatic .
ks08	0	*	oliver addressed the king the letter .
ks08	1		the students of english from seoul faced many issues in the process of interpreting , transcribing , and editing the poems .
ks08	1		the love of my life and father of my children would never do such a thing .
ks08	1		the museum displayed no painting by miro or drawing by klee .
ks08	1		by law , every dog and cat in the area has to be neutered .
ks08	1		learning to use a language freely and fully is a lengthy and arduous process .
ks08	1		kim put the book in the box .
ks08	0	*	kim put the book .
ks08	0	*	is putting the book in the box .
ks08	0	*	talked with bill about the exam .
ks08	1		they wrote to her .
ks08	1		they are kind to her .
ks08	1		they want to write to her .
ks08	0	*	they want to wrote to her .
ks08	1		they want to be kind to her .
ks08	0	*	they want to are kind to her .
ks08	1		the student knows the answers .
ks08	1		the student knew the answers .
ks08	1		the students know the answers .
ks08	0	*	the student knowing the answers .
ks08	0	*	the student known the answers .
ks08	1		he is writing another long book about beavers .
ks08	1		broadly speaking , the project was successful .
ks08	1		he is proud of his son 's passing the bar exam .
ks08	1		the chicken has eaten .
ks08	1		the chicken was eaten .
ks08	1		seen from this perspective , there is no easy solution .
ks08	1		the monkeys kept forgetting their lines .
ks08	0	*	the monkeys kept forgot their lines .
ks08	0	*	the monkeys kept forgotten their lines .
ks08	0	*	we caught them ate the bananas .
ks08	0	*	we caught them eat the bananas .
ks08	0	*	we caught them eaten the bananas .
ks08	1		john made mary cook korean food .
ks08	0	*	john made mary to cook korean food .
ks08	0	*	john made mary cooking korean food .
ks08	1		the monkey seems despondent that it is in a cage .
ks08	1		the monkey seems despondent .
ks08	1		he seems intelligent to study medicine .
ks08	0	*	he seems intelligent to study medicine .
ks08	1		monkeys are eager to leave .
ks08	0	*	monkeys are eager leaving the compound .
ks08	0	*	the chickens seem fond with the farmer .
ks08	1		the foxes seem compatible with the chickens .
ks08	0	*	the foxes seem compatible for the chickens .
ks08	1		these are similar to the bottles .
ks08	0	*	these are similar with the bottles .
ks08	1		the teacher is proud of his students .
ks08	0	*	the teacher is proud with his students .
ks08	1		the contract is subject to approval by my committee .
ks08	0	*	the contract is subject for approval by my committee .
ks08	1		there exists only one truly amphibian mammal .
ks08	1		there arose a great storm .
ks08	1		there exist few solutions which are cost-effective .
ks08	1		there is a riot in the park .
ks08	1		there remained just a few problems to be solved .
ks08	0	*	there runs a man in the park .
ks08	0	*	there sings a man loudly .
ks08	1		they believe that charles darwin 's theory of evolution is just a scientific theory .
ks08	1		they believe charles darwin 's theory of evolution is just a scientific theory .
ks08	1		john demanded that she stop phoning him .
ks08	1		joe warned the class that the exam would be difficult .
ks08	1		we told tom that he should consult an accountant .
ks08	1		mary convinced me that the argument was sound .
ks08	1		tom intends for sam to review that book .
ks08	1		john would prefer for the children to finish the oatmeal .
ks08	1		for john to either make up such a story or repeat it is outrageous .
ks08	1		for john either to make up such a story or to repeat it is outrageous .
ks08	1		for john to tell bill such a lie and bill to believe it is outrageous .
ks08	1		john intends to review the book .
ks08	1		john would prefer to finish the oatmeal .
ks08	1		tom tried to ask a question .
ks08	0	*	tom tried for bill to ask a question .
ks08	1		tom tends to avoid confrontations .
ks08	0	*	tom tends for mary to avoid confrontations .
ks08	1		joe hoped to find a solution .
ks08	0	*	joe hoped for beth to find a solution .
ks08	1		john believed it .
ks08	1		john believed that he is honest .
ks08	1		john mentioned the issue to me .
ks08	1		john mentioned to me that the question is an issue .
ks08	1		she pinched his arm as hard as she could .
ks08	0	*	she pinched that he feels pain .
ks08	1		we hope that such a vaccine could be available in ten years .
ks08	0	*	we hope the availability of such a vaccine in ten years .
ks08	1		cohen proved the independence of the continuum hypothesis .
ks08	1		cohen proved that the continuum hypothesis was independent .
ks08	1		john bothers me .
ks08	1		that john coughed bothers me .
ks08	1		john loves bill .
ks08	0	*	that john coughs loves bill .
ks08	1		that john sold the ostrich surprised bill .
ks08	1		for john to train his horse would be desirable .
ks08	1		to train his horse would be desirable .
ks08	1		that the king or queen be present is a requirement on all royal weddings .
ks08	1		which otter you should adopt first is unclear .
ks08	0	*	that tom missed the lecture was enjoyable .
ks08	0	*	for john to remove the mother is undeniable .
ks08	0	*	how much money gordon spent is true .
ks08	1		tom is confident that the elephants respect him .
ks08	1		tom is insistent that the defendants be truthful .
ks08	1		tom seems eager for her brother to catch a cold .
ks08	1		tom seems eager to catch a cold .
ks08	1		i am ashamed that i neglected you .
ks08	1		i am delighted that mary finished his thesis .
ks08	1		we were thankful that no one had been hurt .
ks08	1		we were glad it was over .
ks08	1		bill alleged that fred signed the check .
ks08	1		we believe that the directors were present .
ks08	1		we convinced him that the operation is safe .
ks08	0	*	alan is thinking about that his students are eager to learn english .
ks08	0	*	fred is counting on for tom to make an announcement .
ks08	1		the outcome depends on how many candidates participate in the election .
ks08	1		fred is thinking about whether he should stay in seoul .
ks08	1		the offer made smith admire the administrators .
ks08	1		john tried to make sam let george ask bill to keep delivering the mail .
ks08	1		john enjoyed drawing trees for his syntax homework .
ks08	1		the picture on the wall reminded him of his country .
ks08	1		free enterprise is compatible with american values and traditions .
ks08	1		we need to be in frequent contact with the clients .
ks08	1		acknowledge that everyone has limits .
ks08	1		we are aware of the existing problems .
ks08	0	*	why do n't you leaving me concentrate on my work ?
ks08	0	*	the general commended that all troops was in dress uniform .
ks08	0	*	my morning routine features swim free styles slowly for one hour .
ks08	0	*	you should avoid to travel in the rush hour .
ks08	0	*	you should attempt answering every question .
ks08	0	*	the authorities blamed greenpeace with the bombing .
ks08	0	*	the authorities charged the students of the cheating .
ks08	0	*	sharon has been eager finishing the book .
ks08	0	*	we respect mary 's desire for becoming famous .
ks08	0	*	john referred from the building .
ks08	0	*	john died to heart disease .
ks08	0	*	we were glad what to do .
ks08	0	*	she was busy to make lunch .
ks08	1		the constant rain forced the abandonment of the next day 's competitions .
ks08	1		aloe may have an analgesic effect on inflammation and minor skin irritations .
ks08	1		the public never had faith in his ability to handle the job .
ks08	1		he repeated his claim that the people backed his action .
ks08	1		we made them take the money .
ks08	0	*	we made them are rude .
ks08	1		do not use these words in the beginning of a sentence .
ks08	1		we know the defendants seem eager to testify against the criminal .
ks08	1		jane is n't sure whether the students keep the books .
ks08	0	*	book is available in most countries .
ks08	0	*	student studies english for 4 hours a day .
ks08	1		students study english for 4 hours a day .
ks08	1		his friend learned dancing .
ks08	1		my bother 's friend learned dancing .
ks08	1		the president 's bodyguard learned surveillance .
ks08	1		the king of rock and roll 's records led to dancing .
ks08	1		president lincoln delivered his gettysburg address in 1863 .
ks08	0	*	president lincoln delivered her gettysburg address in 1863 .
ks08	0	*	after reading the pamphlet , judy threw them into the garbage can .
ks08	1		after the party , i asked myself why i had faxed invitations to everyone in my office building .
ks08	1		edward usually remembered to send a copy of his e-mail to himself .
ks08	1		no john smiths attended the meeting .
ks08	1		this john smith lives in seoul .
ks08	1		there are three davids in my class .
ks08	1		it 's nothing like the america i remember .
ks08	1		my brother is an einstein at maths .
ks08	1		in the book , he talks about his ups and downs at school .
ks08	1		if john wants to succeed in corporate life , he has to know the rules of the game .
ks08	1		the critique of plato 's republic was written from a contemporary point of view .
ks08	1		the characters in shakespeare 's twelfth night live in a world that has been turned upside-down .
ks08	0	*	the characters in shakespeare 's twelfth night lives in a world that has been turned upside-down .
ks08	1		students studying english read conrad 's heart of darkness while at university .
ks08	1		you is the only person that i can rely on .
ks08	0	*	you are the only person that i can rely on .
ks08	1		he is the only person that i can rely on .
ks08	0	*	he are the only person that i can rely on .
ks08	1		the boy swims .
ks08	0	*	the boys swim .
ks08	1		king prawns cooked in chili salt and pepper was very much better , a simple dish deliciously executed .
ks08	1		four pounds was quite a bit of money in 1950 and it was not easy to come by .
ks08	1		five pounds is a lot of money .
ks08	0	*	five pounds are a lot of money .
ks08	1		two drops sanitize anything in your house .
ks08	0	*	two drops sanitize anything in your house .
ks08	1		fifteen dollars in a week is much .
ks08	0	*	fifteen dollars in a week are not much .
ks08	1		fifteen years represents a long period of his life .
ks08	0	*	fifteen years represent a long period of his life .
ks08	1		two miles is as far as they can walk .
ks08	0	*	two miles are as far as they can walk .
ks08	1		this government have been more transparent in the way they have dealt with public finances than any previous government .
ks08	1		this government has been more transparent in the way they have dealt with public finances than any previous government .
ks08	1		in preparation for the return fixture this team has trained more efficiently than they had in recent months .
ks08	1		she does n't believe much of that story .
ks08	1		we listened to as little of his speech as possible .
ks08	1		how much of the fresco did the flood damage ?
ks08	0	*	she does n't believe much story .
ks08	0	*	we listened to as little speech as possible .
ks08	0	*	how much fresco did the flood damage ?
ks08	0	*	i read some book .
ks08	1		one of the people was dying of thirst .
ks08	1		many of the people were dying of thirst .
ks08	0	*	one people was dying of thirst .
ks08	1		many people were dying of thirst .
ks08	1		each of the suggestions is acceptable .
ks08	1		neither of the cars has air conditioning .
ks08	1		none of these men wants to be president .
ks08	1		most of the children are here .
ks08	1		some of the soup needs more salt .
ks08	1		some of the diners need menus .
ks08	1		all of the land belongs to the government .
ks08	1		all of these cars belong to me .
ks08	1		john is in the room .
ks08	1		i am fond of him .
ks08	1		most of john 's boat has been repainted .
ks08	1		some of the record contains evidence of wrongdoing .
ks08	1		much of that theory is unfounded .
ks08	0	*	one of the story has appeared in your newspaper .
ks08	1		he is afraid of foxes .
ks08	1		it is a wooden desk .
ks08	1		it is the main street .
ks08	0	*	it is an alive fish .
ks08	0	*	they are afraid people .
ks08	0	*	this objection is main .
ks08	0	*	this fact is key .
ks08	1		the man eager to start the meeting is john 's sister .
ks08	1		the man holding the bottle disappeared .
ks08	1		the papers removed from the safe have not been found .
ks08	1		the money that you gave me disappeared last night .
ks08	0	*	john in the doorway waved to his father .
ks08	0	*	he in the doorway waved to his father .
ks08	1		and index values of the subject and the main verb .
ks08	1		neither of these men is worthy to lead italy .
