s_97	1	 	whose sister always drinks milk ?
s_97	1		i know the person whose mother 's dog died .
s_97	1		i know the person to whom they dedicated the building .
s_97	1		i wonder what inspired them .
s_97	1		i wonder whose mother 's dog we were all fond of .
s_97	1		my uncle from iowa , whose talking to sandy yesterday annoyed john , is arriving on tuesday .
s_97	0	*	my uncle from iowa , whom talking to sandy yesterday annoyed john , is arriving on tuesday .
s_97	0	*	goes to the store is bothering them .
s_97	0	*	i want to be raining .
s_97	0	*	i 'm looking for a yard in which to be a party .
s_97	0	*	bother yourself that kim left !
s_97	0	*	kim read which book .
s_97	0	*	i think that who went home .
s_97	0	*	a student whom to talk to us just walked in .
s_97	1		i ran into the baker whose bagels i like .
s_97	1		i ran into the baker from whom i bought these bagels .
s_97	1		from whom did you buy these bagels ?
s_97	1		i can find the baker in whom to place your trust .
s_97	1		i wonder who to trust .
s_97	0	*	these bagels , likes .
s_97	0	*	i ran into the baker whose bagels likes .
s_97	0	*	i ran into the baker from whom bought these bagels .
s_97	0	*	when did you wonder what you should say to sandy ?
s_97	0	*	it was to amuse us that they wanted .
s_97	0	*	it was to show us that kim was singing that they wanted .
s_97	0	*	they persuaded us to be no one available .
s_97	1		i prefer for sandy to do the washing and kim to do the drying .
s_97	1		kim gave a book to sandy and a record to dana .
s_97	1		joan offered , and mary actually gave , a gold cadillac to billy .
s_97	1		he does n't intend that , in these circumstances , we be rehired .
s_97	0	*	he does n't intend for , in these circumstances , us to be rehired .
s_97	1		there seems to be no way out .
s_97	1		it seems to be raining .
s_97	0	*	i wonder in whom for them to place their trust .
s_97	0	*	i wonder whom for us to trust .
s_97	0	*	i wonder who us to trust .
s_97	0	*	i ran into the baker who to place your trust in .
s_97	0	*	i ran into the baker whom to place your trust in .
s_97	1		i supported each argument that sandy thought was unconvincing .
s_97	0	*	i dislike all the people that i thought that voted in the election .
s_97	0	*	every essay she 's written and which i 've read is on that pile .
s_97	0	*	every essay she 's written and that i 've read is on that pile .
s_97	1		every essay which she 's written and that i 've read is on that pile .
s_97	1		every essay that she 's written and which i 've read is on that pile .
s_97	0	*	i dislike the person with what we were talking .
s_97	0	*	i dislike the person with who we were talking .
s_97	1		the people who take this course who dana likes usually .
s_97	1		the person i like which everyone else in the class hates is pat .
s_97	1		the only person dana is willing to put up with who i like is pat .
s_97	1		who that you like does sandy also like ?
s_97	1		who whose parents attended the meeting is still enrolled in school ?
s_97	0	*	who you like does sandy also like ?
s_97	1		the only person for us to visit whose kids dana is willing to put up with is sue .
s_97	1		one book for us to read that leslie praised was sense and sensibility .
s_97	0	*	one book that leslie praised for us to read was sense and sensibility .
s_97	1		the bills that we objected to passed by the house last week were vetoed .
s_97	1		the only people who were at harvard being added to our group were students .
s_97	1	 	who always drinks milk ?
s_97	1		the book which inspired them was very long .
s_97	0	*	the book what inspired them was very long .
s_97	1		i know the person whose mother died .
s_97	1		the person whose mother 's dog we were all fond of .
s_97	1		i wonder whose mother died .
s_97	1		i wonder whose mother 's dog died .
s_97	1		i wonder to whom they dedicated the building .
s_97	1		give me the phone number of the person whose mother 's dog died .
s_97	1		this is the senator to whose mother 's friend 's sister 's i sent the letter .
s_97	0	*	i want goes to the store .
s_97	0	*	i wonder what to be a clown on the cover of .
s_97	0	*	bother you that kim left !
s_97	0	*	a student who to talk to us just walked in .
s_97	1		whose bagels do you like ?
s_97	1		i wonder in whom to place my trust .
s_97	1		there were several old rocks songs that she and i were the only two who knew .
s_97	0	*	it was to to amuse us that kim was singing that they wanted .
s_97	0	*	what they feared most was to be no one available to help them .
s_97	0	*	we tried to amuse them that kim was singing .
s_97	1		mary asked me if , in st. louis , john could rent a house cheap .
s_97	0	*	mary arranged for , in st. louis , john to rent a house cheap .
s_97	1		it would be unwise for there to be no fire exit .
s_97	1		i believe there to be no way out .
s_97	0	*	i wonder in whom them to place their trust .
s_97	0	*	i wonder whom us to trust .
s_97	0	*	i wonder who for us to trust .
s_97	1		i wonder who to place my trust in .
s_97	1		i know the people that voted in the election .
s_97	1		i threw away a book that sandy thought we had read .
s_97	1		i thought that you were sick .
s_97	0	*	i dislike the people in who we placed our trust .
s_97	1		i dislike the company in which we placed our trust .
s_97	1		i dislike the people in whose house we stayed .
s_97	1		i dislike the person with whom we were talking .
s_97	0	*	jones , that we were talking to last night , always watches football games alone .
s_97	1		a letter was received that jones would be upset by .
s_97	0	*	a letter was received jones would be upset by .
s_97	1		i saw someone yesterday i had n't seen for years .
s_97	1		something happened i could n't really talk about .
s_97	1		the only person that i like whose kids dana is willing to put up with is pat .
s_97	1		the book that i like which everyone else in the class hates was written by john .
s_97	0	*	the only person whose kids dana is willing to put up with was written by john .
s_97	0	*	the book that i like - everyone else in the class hates .
s_97	1		the only person whose kids dana is willing to put up with is pat .
s_97	1		which book 's , author did you meet ?
s_97	0	*	which boy 's , mother , did you meet who you liked ?
s_97	0	*	which book 's , author did you meet who you liked ?
s_97	1		which boy 's , mother , did you meet ?
s_97	1		all who lost money in the scam are eligible for the program .
s_97	0	*	who for sandy to talk to is still enrolled in the class ?
s_97	1		who who you like does sandy also like ?
s_97	1		everything you like is on the table .
s_97	1		the bills passed by the house yesterday that we objected to were vetoed .
s_97	1		the only people being added to our group who were at harvard were students .
ks08	1		kim lives in the house lee sold to her .
ks08	0	*	the professor was hoping for a strong evidence .
ks08	1		the room contains many armchairs .
ks08	1		the box contains few tools .
ks08	1		the mayor gave john some good cakes .
ks08	0	*	wash myself .
ks08	1		if the weather is lovely today then we will go out .
ks08	1		they read the big book .
ks08	0	*	he treats john very under .
ks08	1		he walked right on the wall .
ks08	0	*	he walked right very .
ks08	1		john thinks bill is honest .
ks08	1		i am anxious you to study english grammar hard .
ks08	1		she thought it was likely that everyone would fit into the car .
ks08	1		the two boys looked up the word .
ks08	1		the happy student played the piano .
ks08	1		i like chocolate cakes and pies .
ks08	1		it was in the park that the policeman met several young students last night .
ks08	1		she was poor but quite happy .
ks08	1		the teacher met his students in the class .
ks08	0	*	i am anxious that you to arrive on time .
ks08	1		she turned down the side street .
ks08	0	*	a nuclear explosion would wipe out plant life and out animal life .
ks08	0	*	he ran down the road and down the president .
ks08	1		my brother wears a green overcoat .
ks08	1		that silly fool broke the teapot .
ks08	1		i threw the puppy the ball .
ks08	1		john made kim a great doctor .
ks08	1		john has been at stanford for four years .
ks08	1		the student heard a strange sound .
ks08	1		john made a doll for his son .
ks08	1		all of his conversation was reported to me .
ks08	1		this is the place to go to .
ks08	1		we need to finish the project this week .
ks08	1		the gang robbed her of her necklace .
ks08	1		they helped us edit the script .
ks08	1		john smelled the freshly baked bread .
ks08	1		kim camps on the hill .
ks08	1		the parents bought the children non-fiction novels .
ks08	1		the parents bought non-fiction novels for the children .
ks08	1		john carried her on his back .
ks08	1		they write to her .
ks08	1		we caught them eating the bananas .
ks08	1		we are content for the cleaners to return the drapes next week .
ks08	1		the soldiers must enforce bill to make the baby be quiet .
ks08	1		rice is available in most countries .
ks08	1		in preparation for the return fixture this team have trained more efficiently than they had in recent months .
ks08	0	*	each of john 's boat has been repainted .
ks08	0	*	many of the record contained evidence of wrongdoing .
ks08	1		he is alive .
ks08	0	*	the committee were unanimous in their decision .
ks08	1		a variety of styles has been in vogue for the last year .
ks08	1		both workers will wear carnations .
ks08	1		few of the doctors approve of our remedy .
ks08	1		you washed me .
ks08	1		sally wishes that everyone would praise her .
ks08	0	*	john is likely to be a letter in the mailbox .
ks08	1		the color red is his favorite color .
ks08	1		pat was persuaded to be examined by the dentist .
ks08	0	*	there seem to be no student absent .
ks08	1		kevin urged anne to be loyal to herself .
ks08	1		john drank water and bill wine .
ks08	1		he must have been being interrogated by the police at that very moment .
ks08	0	*	john will kicking the ball .
ks08	1		john is in the school .
ks08	0	*	the child became never crazy .
ks08	1		are you a student ?
ks08	1		jane likes these apples even more than mary does .
ks08	1		i found myself needing sleep .
ks08	0	*	i found myself should needing sleep .
ks08	0	*	john does leave .
ks08	1		john did not come .
ks08	1		lee never left .
ks08	1		had they been here now , we would n't have this problem .
ks08	1		they 'll be leaving .
ks08	0	*	kim got arrested by the cia , and sandy got , also .
ks08	1		you better not leave it here .
ks08	0	*	the roof is leak .
ks08	0	*	anyone is n't sleeping in my bed .
ks08	1		that he is a fool is believed by no one .
ks08	1		john will have been driving the car .
ks08	1		tv puts ideas into children 's heads .
ks08	1		ideas are put into children 's heads .
ks08	1		the coat does not fit you .
ks08	1		the plan was approved of by my mother .
ks08	0	*	boston was flown to .
ks08	1		heart disease is considered the leading cause of death in the united states .
ks08	1		there was believed to have been a riot in the kitchen .
ks08	1		that we should call the police was suggested by her son .
ks08	1		it was suggested by her son that we should call the police .
ks08	1		the plaza was come into by many people .
ks08	0	*	the king got feared by everyone .
ks08	1		john is clever .
ks08	1		who called the police ?
ks08	1		how frequently did hobbs see rhodes ?
ks08	1		who do you think mary said tom saw ?
ks08	1		that he will help you , you can rely on .
ks08	0	*	this theory captures that arrows do n't stop in midair .
ks08	0	*	who did you compare and ?
ks08	0	*	karen asked where him to vote for .
ks08	0	*	whose did she buy book ?
ks08	1		which rebel leader did you hear rumors that the cia assassinated ?
ks08	1		this is the very book that we need to talk about .
ks08	0	*	what did herb like fruit punch and ?
ks08	0	*	kim is easy to please tom .
ks08	1		fido 's barking annoys me .
ks08	0	*	it is fond of bill that john seems to be .
ks08	1		what you do is wear it like that .
ks08	1		that is what they 're trying to do .
ks08	0	*	that was which i decided to buy .
ks08	1		it was an explosion , what you heard .
ks08	0	*	lee bought which car kim wanted to sell to him .
ks08	1		it was only gradually that i came to realize how stupid i was .
ks08	1		it is john that we are looking for .
ks08	1		this problem will be difficult for the students to solve .
ks08	1		this toy is n't easy to try to hand to the baby .
ks08	1		the man kicked a ball .
ks08	1		a man kicked the ball .
ks08	1		the ball kicked a man .
ks08	1		a ball kicked the man .
ks08	1		the ball , a man kicked .
ks08	1		the man , a ball kicked .
ks08	0	*	kicked the man the ball .
ks08	0	*	man the ball kicked the .
ks08	0	*	the man a ball kicked .
ks08	0	*	kim lives in the house lee sold it to her .
ks08	0	*	kim fond of lee .
ks08	1		kim is fond of lee .
ks08	1		in january 2002 , a dull star in an obscure constellation suddenly became 600,000 times more luminous than our sun , temporarily making it the brightest star in our galaxy .
ks08	1		the man kicked the ball .
ks08	1		the tall man kicked the ball .
ks08	1		the handsome , tall man kicked the ball .
ks08	1		the handsome , tall , nice man kicked the ball .
ks08	1		some sentences can go on .
ks08	1		some sentences can go on and on .
ks08	1		some sentences can go on and on and on .
ks08	1		some sentences can go on and on and on and on .
ks08	1		all native speakers have a grammatical competence which can generate an infinite set of grammatical sentences from a finite set of resources .
ks08	0	*	the professor found some strong evidences of water on mars .
ks08	1		do not end a sentence with a preposition .
ks08	1		avoid double negatives .
ks08	0	*	the evidence that john found was more helpful than the one that smith found .
ks08	0	*	we had hoped to get three new equipments every month , but we only had enough money to get an equipment every two weeks .
ks08	0	*	the equipment we bought last year was more expensive than the one we bought this year .
ks08	1		the student was hoping for a good clue .
ks08	1		the clue that john got was more helpful than the one that smith got .
ks08	1		the student was hoping for a tool .
ks08	1		the tool that jones got was more helpful than the one that smith got .
ks08	1		much evidence is needed .
ks08	1		much equipment is needed .
ks08	1		much information is needed .
ks08	1		much furniture is needed .
ks08	1		much advice is needed .
ks08	0	*	much clue is needed .
ks08	0	*	much tool is needed .
ks08	0	*	much armchair is needed .
ks08	0	*	much bags is needed .
ks08	0	*	many evidence was provided .
ks08	0	*	many equipment is available .
ks08	0	*	the room contains many furniture .
ks08	1		the paper provides many clues .
ks08	1		the box contains many tools .
ks08	1		john offers many suggestions .
ks08	1		little evidence was provided .
ks08	1		little equipment is available .
ks08	1		john offers little advice .
ks08	1		little information was provided .
ks08	0	*	little clue could be found .
ks08	0	*	the box contains little tool .
ks08	0	*	john offers little suggestion .
ks08	0	*	the room contains little armchair .
ks08	0	*	few evidence was provided .
ks08	0	*	few equipment is available .
ks08	0	*	the room contains few furniture .
ks08	0	*	john offers few advice .
ks08	0	*	few information was provided .
ks08	1		few clues could be found .
ks08	1		john offers few suggestions .
ks08	1		the room contains few armchairs .
ks08	1		the president was hoping for a good cake .
ks08	1		the bartender gave john some good beers .
ks08	1		no one knows how to tell from a good beer to a bad one .
ks08	1		my pastor says i ate too much cake .
ks08	1		the students drank too much beer last night .
ks08	1		people now drink less beer .
ks08	1		in english , the main verb agrees with the head element of the subject .
ks08	0	*	the recent strike by pilots have cost the country a great deal of money from tourism and so on .
ks08	0	*	the average age at which people begin to need eyeglasses vary considerably .
ks08	0	*	despite of his limited educational opportunities , abraham lincoln became one of the greatest intellectuals in the world .
ks08	0	*	a pastor was executed , notwithstanding on many applications in favor of him .
ks08	1		visiting relatives can be boring .
ks08	1		he said that that ` that ' that that man used was wrong .
ks08	1		kim and sandy is looking for a new bicycle .
ks08	1		i have never put the book .
ks08	1		the boat floated down the river sank .
ks08	1		chris must liking syntax .
ks08	1		there is eager to be fifty students in this class .
ks08	1		what is john eager to do ?
ks08	1		what is john easy to do ?
ks08	1		is the boy who holding the plate can see the girl ?
ks08	1		which chemical did you mix the hydrogen peroxide and ?
ks08	1		there seem to be a good feeling developing among the students .
ks08	1		strings have been pulled many times to get students into that university .
ks08	1		he washed himself .
ks08	0	*	he washed herself .
ks08	0	*	he washed myself .
ks08	0	*	he washed ourselves .
ks08	1		he washed me .
ks08	1		he washed us .
ks08	1		wash yourself .
ks08	1		wash yourselves .
ks08	0	*	wash himself .
ks08	1		wash me !
ks08	1		the weather is lovely today .
ks08	1		i am hoping that the weather is lovely today .
ks08	1		the birds are singing because the weather is lovely today .
ks08	1		they read the book .
ks08	1		he treats john very .
ks08	1		he walked right the wall .
ks08	1		they have no tv .
ks08	1		they have no car .
ks08	1		they have no information .
ks08	1		they have no friend .
ks08	0	*	they have no went .
ks08	0	*	they have no old .
ks08	0	*	they have no and .
ks08	1		they can sing .
ks08	1		they can run .
ks08	1		they can smile .
ks08	1		they can cry .
ks08	0	*	they can happy .
ks08	0	*	they can down .
ks08	0	*	they can door .
ks08	0	*	they can very .
ks08	1		they read the new book .
ks08	1		they read the interesting book .
ks08	1		they read the scientific book .
ks08	0	*	they read the sing book .
ks08	0	*	they read the under book .
ks08	0	*	they read the every book .
ks08	1		he treats john very nicely .
ks08	1		he treats john very badly .
ks08	1		he treats john very kindly .
ks08	0	*	he treats john very kind .
ks08	0	*	he treats john very shame .
ks08	1		he walked right into the wall .
ks08	0	*	he walked right happy .
ks08	0	*	he walked right the wall .
ks08	1		john sang a song , mary played the piano .
ks08	1		we found out that very lucrative jobs were in jeopardy .
ks08	0	*	my these jobs are in jeopardy .
ks08	0	*	the his jobs are in jeopardy .
ks08	1		i think learning english is not easy at all .
ks08	1		i doubt you can help me in understanding this .
ks08	1		i think that learning english is not all that easy .
ks08	1		i doubt if you can help me in understanding this .
ks08	1		i am anxious for you to study english grammar hard .
ks08	0	*	i think that learning english to be not all that easy .
ks08	0	*	i doubt if you to help me in understanding this .
ks08	0	*	i am anxious for you should study english grammar hard .
ks08	1		john not leave .
ks08	1		john drink beer last night .
ks08	1		john leave for seoul tomorrow ?
ks08	1		john will study syntax , and mary , too .
ks08	1		he left .
ks08	1		he did not leave .
ks08	1		students wanted to write a letter .
ks08	1		students intended to surprise the teacher .
ks08	1		students objected to the teacher .
ks08	1		students sent letters to the teacher .
ks08	1		it is crucial for john to show an interest .
ks08	1		it is crucial that john should show an interest .
ks08	1		i know i should go to the dentist 's , but i just do n't want to .
ks08	1		i do n't really want to go to the dentist 's , but i know i should .
ks08	0	*	she thought it was likely that everyone to fit into the car .
ks08	1		she thought it was likely that everyone might fit into the car .
ks08	1		she thought it was easy for everyone to fit into the car .
ks08	0	*	she thought it was easy for everyone would fit into the car .
ks08	1		the umpire called off the game .
ks08	1		the umpire called the game off .
ks08	1		the two boys looked the word up .
ks08	1		the umpire fell off the deck .
ks08	1		the two boys looked up the high stairs .
ks08	1		the two boys looked up the high stairs from the floor .
ks08	0	*	the umpire fell the deck off .
ks08	0	*	the students looked the high stairs up from the floor .
ks08	0	*	the students looked the high stairs up .
ks08	1		the umpire called it of .
ks08	0	*	the umpire called off it .
ks08	0	*	the umpire fell it off .
ks08	1		the umpire fell off it .
ks08	1		a tall boy threw the ball .
ks08	1		the cat chased the long string .
ks08	1		that ball hit a student .
ks08	1		the piano played a song .
ks08	1		the piano kicked a student .
ks08	1		that ball sang a student .
ks08	1		the tall , handsome man kicked the ball .
ks08	1		the tall , kind , handsome man kicked the ball .
ks08	1		the happy , happy , happy , happy , happy , happy man sang a song .
ks08	1		the mother of the boy and the girl is arriving soon .
ks08	1		the mother of the boy and the girl are arriving soon .
ks08	1		john saw the man with a telescope .
ks08	1		we need more intelligent leaders .
ks08	1		the student enjoyed his english syntax class last semester .
ks08	1		the policeman met several young students in the park last night .
ks08	1		it was the policeman that met several young students in the park last night .
ks08	1		it was several young students that the policeman met in the park last night .
ks08	1		it was last night that the policeman met several young students in the park .
ks08	0	*	it was several young students in that the policeman met the park last night .
ks08	0	*	it was in the park last night that the policeman met several young students .
ks08	1		where did the policeman meet several young students ?
ks08	1		what did you put in your box ?
ks08	1		where did you put the book ?
ks08	1		what did you do ?
ks08	1		john looked up the inside of the chimney .
ks08	1		john looked up the meaning of ` chanson ' .
ks08	1		what did he look up ?
ks08	1		where did he look ?
ks08	1		up what did he look ?
ks08	1		what do you think the man who is standing by the door is doing now ?
ks08	1		what do you think he is doing now ?
ks08	1		have you been to seoul ?
ks08	1		john might go home , so might bill .
ks08	1		john might pass the exam , and as might bill .
ks08	1		if john can speak french fluently – which we all know he can – we will have no problems .
ks08	1		john asked me to put the clothes in the cupboard , and to annoy him i really stuffed them there .
ks08	1		john asked me to put the clothes in the cupboard , and to annoy him i stuffed them there .
ks08	0	*	john asked me to put the clothes in the cupboard , but i did so put the clothes in the suitcase .
ks08	1		the girls played in the water and swam under the bridge .
ks08	1		the children were neither in their rooms nor on the porch .
ks08	1		many people drink beer or wine .
ks08	0	*	mary waited for the bus and to go home .
ks08	0	*	lee went to the store and crazy .
ks08	1		liked ice cream .
ks08	0	*	the whistle tune was beautiful .
ks08	0	*	the easily student finished his homework .
ks08	0	*	the my dog is a terrier .
ks08	1		the monkey wants to leave the meeting .
ks08	0	*	the monkey eager to leave the meeting .
ks08	1		the monkeys approved of their leader .
ks08	1		the men practice medicine .
ks08	0	*	the men doctors of medicine .
ks08	1		john read the book loudly .
ks08	1		john sounded happy .
ks08	1		john felt proud that his son won the game .
ks08	0	*	john sounded happily .
ks08	0	*	john sounded the student .
ks08	0	*	john sounded in the park .
ks08	0	*	the monkeys seem want to leave the meeting .
ks08	1		the monkeys seem eager to leave the meeting .
ks08	0	*	john seems know about the bananas .
ks08	1		john seems certain about the bananas .
ks08	1		john came from seoul .
ks08	1		they put the book in the box .
ks08	1		they stayed in the hotel .
ks08	1		the fly fell into the soup .
ks08	1		the squirrel ran straight .
ks08	1		the squirrel ran right up the tree .
ks08	0	*	the squirrel is right angry .
ks08	0	*	the squirrel ran straight quickly .
ks08	0	*	the squirrel ran right quickly .
ks08	1		this handsome man chased a dog .
ks08	1		a man kicked that ball .
ks08	1		that tall woman chased a cat .
ks08	1		his friend kicked a ball .
ks08	1		bill claims john believes mary thinks tom is honest .
ks08	1		jane imagines bill claims john believes mary thinks tom is honest .
ks08	1		the little boy hit the child with a toy .
ks08	1		chocolate cakes and pies are my favorite desserts .
ks08	0	*	the children were in their rooms or happily .
ks08	1		john suddenly got off the bus .
ks08	1		john suddenly put off the customers .
ks08	0	*	john suddenly got the bus off .
ks08	1		john suddenly put the customers off .
ks08	1		his second book came out earlier this year and became an instant best-seller .
ks08	1		when you book something such as a hotel room , you arrange to have it .
ks08	1		price quotes on selected categories will be sent out upon request .
ks08	1		no doubt that he was forced to leave his family against his will .
ks08	1		he intended to will the large amount of money to frank .
ks08	1		jane stood aside to let her pass .
ks08	1		he has a rail pass that 's right for you .
ks08	1		it is important for us to spend time with children .
ks08	1		he was arrested for being drunk .
ks08	1		i think that person we met last week is insane .
ks08	1		we believe that he is quite reasonable .
ks08	1		i forgot to return the book that i borrowed from the teacher .
ks08	1		i am anxious that you should arrive on time .
ks08	1		i am anxious for you to arrive on time .
ks08	0	*	i am anxious for you should arrive on time .
ks08	1		i wonder whether you 'd be kind enough to give us information .
ks08	1		if students study hard , teachers will be happy .
ks08	1		whether they say it or not , most teachers expect their students to study hard .
ks08	1		john put a book on the table .
ks08	1		she turned down his offer .
ks08	1		he looked at a book about swimming .
ks08	1		he talked to a girl about swimming .
ks08	1		he talked with a girl about swimming .
ks08	1		i do n't know the people present .
