ks08	1		none of his customary excuses suffices edgar now .
ks08	1		one of the problems was the robins .
ks08	1		all of the plant virus web sites have been conveniently collected in one central location .
ks08	1		some of the water from melted snow also goes into the ground for plants .
ks08	1		most of the milk your baby consumes during breastfeeding is produced during nursing .
ks08	1		all special rights of voting in the election were abolished .
ks08	1		one of major factors affecting the value of diamonds was their weight .
ks08	1		each of these stones has to be cut and polished .
ks08	1		most of her free time was spent attending concerts and plays or visiting museums and art galleries .
ks08	1		the committee was unanimous in their decision .
ks08	1		the committee have all now resigned .
ks08	0	*	the committee has all now resigned .
ks08	1		the crew have both agreed to change sponsor .
ks08	0	*	the crew has both agreed to change sponsor .
ks08	1		her family is all avid skiers .
ks08	0	*	her family are all avid skiers .
ks08	0	*	a variety of styles have been in vogue for the last year .
ks08	1		both of the workers will wear carnations .
ks08	1		both the workers will wear carnations .
ks08	1		both will wear carnations .
ks08	1		few doctors approve of our remedy .
ks08	1		few approve of our remedy .
ks08	1		an example of these substances be tobacco .
ks08	1		the effectiveness of teaching and learning depend on several factors .
ks08	1		one of the most serious problems that some students have be lack of motivation .
ks08	1		ten years be a long time to spend in prison .
ks08	1		everyone of us be given a prize .
ks08	1		some of the fruit be going bad .
ks08	1		all of his wealth come from real estate investments .
ks08	1		do some of your relatives live nearby ?
ks08	1		fifty pounds seem like a lot of weight to lose in one year .
ks08	1		news of persephone and demeter reach the great gods and goddesses of olympus .
ks08	1		half of the year be dark and wintry .
ks08	1		some of the promoters of ostrich meat compare its taste to beef tenderloin .
ks08	1		the committee has n't yet made up its mind .
ks08	0	*	the committee has n't yet made up their mind .
ks08	1		the committee have n't yet made up their mind .
ks08	0	*	the committee have n't yet made up its mind .
ks08	0	*	that dog is so ferocious , it even tried to bite himself .
ks08	0	*	i washed me .
ks08	1		i washed myself .
ks08	0	*	you washed myself .
ks08	1		i washed you .
ks08	1		he kicked you .
ks08	0	*	i washed yourself .
ks08	1		you washed yourself .
ks08	1		harry says that sally dislikes him .
ks08	0	*	harry says that sally dislikes himself .
ks08	0	*	sally wishes that everyone would praise herself .
ks08	1		sally believes that she is brilliant .
ks08	0	*	sally believes that herself is brilliant .
ks08	1		the power of your mind and the power of your body have a tight connection .
ks08	1		john tries to fix the computer .
ks08	1		john seems to fix the computer .
ks08	1		mary persuaded john to fix the computer .
ks08	1		mary expected john to fix the computer .
ks08	0	*	john to fix the computer .
ks08	0	*	seems john to fix the computer .
ks08	1		john tries to be honest .
ks08	1		john seems to be honest .
ks08	1		john makes efforts for himself to be honest .
ks08	1		it seems that john is honest .
ks08	1		it tends to be warm in september .
ks08	1		it seems to bother kim that they resigned .
ks08	0	*	it tries to be warm in september .
ks08	0	*	it hopes to bother kim that they resigned .
ks08	1		it is easy to please kim .
ks08	1		john is eager to please kim .
ks08	0	*	there tries to be warm in september .
ks08	0	*	there hopes to bother kim that they resigned .
ks08	0	*	it is eager to please kim .
ks08	1		stephen seemed to be intelligent .
ks08	1		it seems to be easy to fool ben .
ks08	1		there is likely to be a letter in the mailbox .
ks08	1		tabs are likely to be kept on participants .
ks08	0	*	john seems to be easy to fool ben .
ks08	0	*	john is likely to be kept on participants .
ks08	1		sandy tried to eat oysters .
ks08	0	*	there tried to be riots in seoul .
ks08	0	*	it tried to bother me that chris lied .
ks08	0	*	tabs try to be kept on bob by the fbi .
ks08	0	*	that he is clever is eager to be obvious .
ks08	1		the king thanked the man .
ks08	1		the color red seems to be his favorite color .
ks08	1		the cat seems to be out of the bag .
ks08	1		the dentist is likely to examine pat .
ks08	1		pat is likely to be examined by the dentist .
ks08	1		the dentist is eager to examine pat .
ks08	1		pat is eager to be examined by the dentist .
ks08	1		stephen believed ben to be careful .
ks08	1		stephen persuaded ben to be careful .
ks08	1		stephen believed it to be easy to please kim .
ks08	0	*	stephen persuaded it to be easy to please kim .
ks08	1		stephen believed there to be a fountain in the park .
ks08	0	*	stephen persuaded there to be a fountain in the park .
ks08	1		stephen believed the cat to be out of the bag .
ks08	0	*	stephen persuaded the cat to be out of the bag .
ks08	1		the dentist was believed to have examined pat .
ks08	1		pat was believed to have been examined by the dentist .
ks08	1		the dentist was persuaded to examine pat .
ks08	1		stephen seems to be irritating .
ks08	1		tom believes stephen to be irritating .
ks08	1		john persuaded stephen to be more careful .
ks08	0	*	it seemed to be intelligent .
ks08	1		it seemed to rain .
ks08	1		there seemed to be a fountain in the park .
ks08	1		stephen tried to be intelligent .
ks08	0	*	it tried to be intelligent .
ks08	0	*	there tried to be intelligent .
ks08	0	*	it tried to rain .
ks08	0	*	there tried to be a fountain in the park .
ks08	1		someone tried to leave the town .
ks08	1		there seems to be a fountain in the park .
ks08	0	*	it seems to be a fountain in the park .
ks08	0	*	john seems to be a fountain in the park .
ks08	1		we believed there to be a fountain in the park .
ks08	0	*	we believed it to be a fountain in the park .
ks08	0	*	there tries to leave the country .
ks08	0	*	we believed it to try to leave the country .
ks08	0	*	we believed there to try to leave the country .
ks08	1		we believed john to try to leave the country .
ks08	1		the cat tries to be out of the bag .
ks08	1		they persuaded me to leave .
ks08	1		they promised me to leave .
ks08	0	*	they persuaded it to rain .
ks08	0	*	they promised it to rain .
ks08	1		under the bed is a fun place to hide .
ks08	0	*	under the bed wants to be a fun place to hide .
ks08	1		kim may have admitted to let mary mow the lawn .
ks08	1		gregory appears to have wanted to be loyal to the company .
ks08	1		jones would prefer for it to be clear to barry that the city plans to sue him .
ks08	1		john continues to avoid the conflict .
ks08	1		the captain ordered the troops to proceed .
ks08	1		he coaxed his brother to give him the candy .
ks08	1		john wants it to be clear to ben that the city plans to honor him .
ks08	0	*	john seems to rain .
ks08	0	*	john is likely to appear that he will win the game .
ks08	0	*	beth tried for bill to ask a question .
ks08	0	*	he believed there to be likely that he won the game .
ks08	0	*	it is likely to seem to be arrogant .
ks08	0	*	sandy appears that kim is happy .
ks08	0	*	dana would be unlikely for pat to be called upon .
ks08	0	*	robin is nothing in the box .
ks08	0	*	it said that kim was happy .
ks08	0	*	there preferred for sandy to get the job .
ks08	1		there is only one chemical substance involved in nerve transmission .
ks08	0	*	there are only one chemical substance involved in nerve transmission .
ks08	0	*	there is more chemical substances involved in nerve transmission .
ks08	1		there are more chemical substances involved in nerve transmission .
ks08	1		there is believed to be a sheep in the park .
ks08	0	*	there is believed to be a sheep in the park .
ks08	1		there are believed to be sheep in the park .
ks08	1		there seems to be no student absent .
ks08	0	*	there are likely to be no student absent .
ks08	1		there is likely to be no student absent .
ks08	1		pat expected leslie to be aggressive .
ks08	1		pat persuaded leslie to be aggressive .
ks08	1		pat promised leslie to be aggressive .
ks08	1		kevin urged anne to be loyal to her .
ks08	1		we expect the dentist to examine us .
ks08	0	*	we expect the dentist to examine ourselves .
ks08	1		we expect them to examine themselves .
ks08	1		we persuaded the dentist to examine us .
ks08	0	*	we persuaded the dentist to examine ourselves .
ks08	1		we persuaded them to examine themselves .
ks08	0	*	we persuaded them to examine them .
ks08	1		john may drink water , and bill drink beer .
ks08	1		tom will not leave .
ks08	0	*	tom kicked not a ball .
ks08	1		will tom leave the party now ?
ks08	0	*	left tom the party already ?
ks08	1		john could n't leave the party .
ks08	0	*	john left n't the party early .
ks08	1		if anybody is spoiling the children , john is .
ks08	0	*	if anybody keeps spoiling the children , john keeps .
ks08	1		you should leave , should n't you ?
ks08	0	*	you did n't leave , left you ?
ks08	1		she would never believe that story .
ks08	0	*	she believed never his story .
ks08	1		the boys will all be there .
ks08	0	*	our team played all well .
ks08	1		the children will have been being entertained .
ks08	0	*	the house is been remodelling .
ks08	0	*	margaret has had already left .
ks08	0	*	he has will seeing his children .
ks08	0	*	he has been must being interrogated by the police at that very moment .
ks08	1		mary solved the problem .
ks08	1		mary would solve the problem .
ks08	1		mary was solving the problem .
ks08	1		mary would easily solve the problem .
ks08	0	*	mary not avoided bill .
ks08	1		mary did not avoid bill .
ks08	1		fred must have been singing songs and probably was drinking beer .
ks08	1		fred must both have been singing songs and have been drinking beer .
ks08	1		fred must have both been singing songs and been drinking beer .
ks08	1		fred must have been both singing songs and drinking beer .
ks08	1		there might be a unicorn in the garden .
ks08	1		it will rain tomorrow .
ks08	1		john will leave the party earlier .
ks08	0	*	there hopes to finish the project .
ks08	0	*	the bus hopes to be here at five .
ks08	0	*	i hope to can study in france .
ks08	1		i hope to study in france .
ks08	0	*	john stopped can to sign in tune .
ks08	0	*	john stopped canning to sign in tune .
ks08	0	*	john wills leave the party early .
ks08	0	*	john can kicked the ball .
ks08	0	*	john can kicking the ball .
ks08	0	*	john can to kick the ball .
ks08	1		john will kick the ball .
ks08	0	*	john will kicked the ball .
ks08	0	*	john will to kick the ball .
ks08	0	*	kim must bakes a cake .
ks08	0	*	kim must baked a cake .
ks08	0	*	kim must will bake a cake .
ks08	1		there may exist a man in the park .
ks08	0	*	it may exist a man in the park .
ks08	0	*	it is vital that we will study everyday .
ks08	1		he is a fool .
ks08	1		he has a car .
ks08	1		john is running to the car .
ks08	1		was the child in the school ?
ks08	1		was the child running to the car ?
ks08	1		was the child found ?
ks08	1		the child never became crazy .
ks08	1		the child was never crazy .
ks08	1		the child was never running to the car .
ks08	1		the child was never deceived .
ks08	1		john is happy about the outcome .
ks08	1		john was seeing his children .
ks08	1		the children are seen in the yard .
ks08	1		john has not sung a song .
ks08	1		has john sung a song ?
ks08	1		john has n't been singing a song .
ks08	1		john has sung a song and mary has too .
ks08	1		john can have danced .
ks08	1		john can be dancing .
ks08	1		he has seen his children .
ks08	1		he will have been seeing his children .
ks08	0	*	americans have paying income tax ever since 1913 .
ks08	0	*	george has went to america .
ks08	1		is out since the following is finite .
ks08	1		you are a student .
ks08	1		you have not enough money .
ks08	1		have you enough money ?
ks08	1		john does not like this town .
ks08	1		in no other circumstances does that distinction matter .
ks08	1		they did n't leave any food .
ks08	0	*	they expected us to do leave him .
ks08	0	*	they expected us to should leave him .
ks08	0	*	i found myself doing need sleep .
ks08	0	*	he does be leaving .
ks08	0	*	he does have been eating .
ks08	0	*	they will do come .
ks08	1		john did leave .
ks08	1		did john find the solution ?
ks08	1		how long did it last ?
ks08	1		john may leave .
ks08	1		it may rain .
ks08	0	*	john may rain .
ks08	1		john did not leave .
ks08	0	*	john did not rain .
ks08	1		he might have left .
ks08	0	*	he might do leave .
ks08	0	*	he does can leave here .
ks08	0	*	he does may leave here .
ks08	0	*	jim does have supported the theory .
ks08	0	*	the proposal did be endorsed by clinton .
ks08	0	*	i do not have sung .
ks08	0	*	i do not be happy .
ks08	1		do be honest !
ks08	1		do n't be silly !
ks08	0	*	john believed kim to do not leave here .
ks08	1		john believes kim not to leave here .
ks08	0	*	john believed kim to leaving here .
ks08	0	*	john did not leaving here .
ks08	0	*	john expect to must leave .
ks08	0	*	john did not may leave .
ks08	1		tom wanted to go home , but peter did n't want to .
ks08	1		lee voted for bill because his father told him to .
ks08	1		kim regrets not having seen the movie .
ks08	1		kim regrets never having seen the movie .
ks08	1		we asked him not to try to call us again .
ks08	1		we asked him never to try to call us again .
ks08	1		duty made them not miss the weekly meetings .
ks08	1		duty made them never miss the weekly meetings .
ks08	1		not speaking english is a disadvantage .
ks08	0	*	speaking not english is a disadvantage .
ks08	0	*	lee likes not kim .
ks08	1		lee is believed not to like kim .
ks08	1		lee is believed to not like kim .
ks08	0	*	lee is believed to like not kim .
ks08	1		the president could not approve the bill .
ks08	1		it would be possible for the president not to approve the bill .
ks08	1		it would not be possible for the president to approve the bill .
ks08	0	*	lee not left .
ks08	1		lee will never leave .
ks08	1		lee will not leave .
ks08	1		john could not leave the town .
ks08	0	*	john not left the town .
ks08	0	*	john not could leave the town .
ks08	1		mary sang a song , but lee never did .
ks08	0	*	mary sang a song , but lee did never .
ks08	1		mary sang a song , but lee did not .
ks08	1		the president could not approve the bill , could n't he ?
ks08	0	*	the president could not approve the bill , could he ?
ks08	1		are you studying english syntax ?
ks08	1		what are you studying nowadays ?
ks08	1		i shall go downtown .
ks08	1		shall i go downtown ?
ks08	1		may she live forever !
ks08	1		was i that stupid ?
ks08	1		do n't you even touch that !
ks08	1		you better not drink .
ks08	1		you can do it , but you better not .
ks08	0	*	better you not drink .
ks08	1		they 'd leave soon .
ks08	1		they would n't leave soon .
ks08	1		they should n't leave soon .
ks08	1		they can do it , ca n't they ?
ks08	1		they ca n't do it , can they ?
ks08	0	*	they ca n't do it , ca n't they ?
ks08	0	*	they ca n't do it , can he ?
ks08	1		kim can dance , and sandy can , too .
ks08	1		kim has danced , and sandy has , too .
ks08	1		kim was dancing , and sandy was , too .
ks08	0	*	kim considered joining the navy , but i never considered .
ks08	0	*	kim wanted to go and sandy wanted , too .
ks08	1		kim is happy and sandy is too .
ks08	1		when kim was in china , i was too .
ks08	1		have you anything to share with the group ?
ks08	1		have you brought anything to share with the group ?
ks08	1		sandy must have been , too .
ks08	1		sandy must have , too .
ks08	1		sandy must , too .
ks08	1		because john persuaded sally to , he did n't have to talk to the reporters .
ks08	0	*	mary sang a song , but lee could never .
ks08	1		mary sang a song , but lee could not .
ks08	1		john got sent to prison .
ks08	1		he ought to leave his luggage here .
ks08	1		he dared not argue against his parents .
ks08	1		he used to go there very often .
ks08	1		the gardener must trim the rose bushes today .
ks08	1		this should be the beginning of a beautiful friendship .
ks08	1		i am removing the shovel from the shed .
ks08	1		the travelers have returned from their vacation .
ks08	1		springfield would have built a police station with the federal grant .
ks08	1		sharks could have been cruising near the beach .
ks08	1		she seem to have given financial assistance to an important french art dealer .
ks08	0	*	ann may spending her vacation in italy .
ks08	0	*	ann may spends her vacation in italy .
ks08	0	*	ann may spent her vacation in italy .
ks08	1		it has rained every day for the last week .
ks08	0	*	it has raining every day for the last week .
ks08	0	*	it has rains every day for the last week .
ks08	0	*	it has rain every day for the last week .
ks08	1		tagalog is spoken in the philippines .
ks08	0	*	tagalog is speak in the philippines .
ks08	0	*	tagalog is speaks in the philippines .
ks08	0	*	tagalog is spoke in the philippines .
ks08	1		the roof is leaking .
ks08	0	*	the roof is leaked .
ks08	0	*	the roof is leaks .
ks08	0	*	george is having lived in toledo for thirty years .
ks08	0	*	the house is been remodeling .
ks08	0	*	a medal was been given to the mayor by the sewer commissioner .
ks08	0	*	does john have gone to the library ?
ks08	0	*	john seems fond of ice cream , and bill seems , too .
ks08	1		sam may have been being interrogated by the fbi .
ks08	0	*	sam may have been being interrogating by the fbi .
ks08	0	*	sam may be had been interrogating by the fbi .
ks08	1		have social problems made police work difficult ?
ks08	1		the senator should not have forgotten the concerns of her constituents .
ks08	1		tokyo has not loosened trade restrictions .
ks08	1		did the doctor prescribe aspirin ?
ks08	1		sandy will read your reports , but harold will not .
ks08	1		he can hardly believe that it 's already over .
ks08	1		i could have little known that more trouble was just around the corner .
ks08	1		i have never been spoken to so rudely !
ks08	1		hardly was there any rain falling .
ks08	1		little did i know that more trouble was just around the corner .
ks08	1		never have i been spoken to so rudely !
ks08	1		he had hardly collected the papers on his desk , had he ?
ks08	0	*	he had hardly collected the papers on his desk , had n't he ?
ks08	1		he never achieved anything , did he ?
ks08	0	*	he never achieved anything , did n't he ?
ks08	1		as a statesman , he scarcely could do anything worth mentioning .
ks08	0	*	as a statesman , scarcely he could do anything worth mentioning .
ks08	0	*	any zebras ca n't fly .
ks08	0	*	anything has n't happened to his optimism .
ks08	0	*	any of the citizens hardly ever say anything .
ks08	1		i did n't find any bugs in my bed .
ks08	1		nobody told them anything .
ks08	1		never have i stolen from any members of your family .
ks08	1		why have n't any books been returned ?
ks08	1		hardly any of the citizens ever say anything .
ks08	1		these lines were written by one of korea 's most famous poets .
ks08	1		the unidentified victim was apparently struck during the early morning hours .
ks08	1		targets can be observed at any angle .
ks08	1		during the early evening , saturn can be found in the north , while jupiter rises in the east .
ks08	1		i poured 20 liters of acid into the beaker .
ks08	1		about 20 liters of acid was poured into the beaker .
ks08	1		the executive committee approved the new policy .
ks08	1		the new policy was approved by the executive committee .
ks08	1		john has taken bill to the library .
ks08	1		john has chosen bill for the position .
ks08	0	*	john has taken to the library .
ks08	0	*	john has chosen for the position .
ks08	0	*	the guide has been taken john to the library .
ks08	0	*	the department has been chosen john for the position .
ks08	1		john has been taken to the library .
ks08	1		john has been chosen for the position .
ks08	1		pat handed a book to chris .
ks08	0	*	pat handed to chris .
ks08	0	*	pat handed a book .
ks08	1		a book was handed to chris by pat .
ks08	0	*	a book was handed by pat .
ks08	1		a book was handed to chris .
ks08	0	*	a book was handed .
ks08	1		they believe it to be easy to annoy ben .
ks08	0	*	they believe stephen to be easy to annoy ben .
ks08	1		they believe there to be a dragon in the wood .
ks08	1		it is believed to be easy to annoy ben .
ks08	0	*	stephen is believed to be easy to annoy ben .
ks08	1		there is believed to be a dragon in the wood .
ks08	1		no one believes that he is a fool .
ks08	1		no one suspects that he is a fool .
ks08	1		that he is a fool is suspected by no one .
ks08	1		they believe the cat to be out of the bag .
ks08	1		the cat is believed to be out of the bag .
ks08	1		john drove the car .
ks08	1		john was driving the car .
ks08	1		the car was being driven .
ks08	1		john will drive the car .
ks08	1		the car will be driven .
ks08	1		john has driven the car .
ks08	1		the car has been driven .
ks08	1		john has been driving the car .
ks08	1		the car has been being driven .
ks08	1		the car will have been being driven .
ks08	1		pat handed chris a note .
ks08	1		chris was handed a note .
ks08	1		chris was handed a note by pat .
ks08	1		ideas are put into children 's heads by tv .
ks08	1		yesterday , the child really kicked a monkey in the street .
ks08	1		the model resembles kim in nearly every detail .
ks08	0	*	kim is resembled by the model in nearly every detail .
ks08	0	*	you are not fitted by the coat .
ks08	1		i was born in 1970 .
ks08	1		it is rumored that he is on his way out .
ks08	1		john is said to be rich .
ks08	1		he is reputed to be a good scholar .
ks08	0	*	my mother bore me in 1970 .
ks08	0	*	everyone rumored that he was on his way out .
ks08	0	*	they said him to be rich .
ks08	0	*	they reputed him to be a good scholar .
ks08	1		he kicked the ball .
ks08	1		the ball was kicked by him .
ks08	1		john kicked him .
ks08	1		he was kicked by john .
ks08	1		john sent her to seoul .
ks08	1		she was sent to seoul .
ks08	1		they widely believed that john was ill .
ks08	1		that john was ill was widely believed .
ks08	1		they have n't decided which attorney will give the closing argument .
ks08	1		which attorney will give the closing argument has n't been decided .
ks08	1		which attorney will give the closing argument has n't been decided by them .
ks08	1		you can rely on ben .
ks08	1		ben can be relied on .
ks08	1		they talked about the scandal for days .
ks08	1		the scandal was talked about for days .
ks08	1		the issue was dealt with promptly .
ks08	1		that 's not what 's asked for .
ks08	1		this should be attended to immediately .
ks08	0	*	the capital was gathered near by a crowd of people .
ks08	0	*	the hot sun was played under by the children .
ks08	1		that 's something i would have paid twice for .
ks08	1		these are the books that we have gone most thoroughly over .
ks08	1		they look generally on john as selfish .
ks08	0	*	everything was paid twice for .
ks08	0	*	your books were gone most thoroughly over .
ks08	0	*	he is looked generally on as selfish .
ks08	1		pavarotti relied on loren and bond on hepburn .
ks08	0	*	pavarotti relied on loren and bond hepburn .
ks08	1		loren was relied on by pavarotti and hepburn by bond .
ks08	0	*	loren was relied on by pavarotti and hepburn on by bond .
ks08	1		the lawyer looked into the document .
ks08	1		the document was looked into by the lawyer .
ks08	1		peter has been asked to resign .
ks08	1		i assume the matter to have been filed in the appropriate records .
ks08	1		smith wants the picture to be removed from the office .
ks08	1		the events have been described well .
ks08	1		over 120 different contaminants have been dumped into the river .
ks08	1		the balloon is positioned in an area of blockage and is inflated .
ks08	1		cancer is now thought to be unlikely to be caused by hot dogs .
ks08	1		whether this is feasible has n't yet been determined .
ks08	1		paying taxes ca n't be avoided .
ks08	1		it has n't yet been determined whether this is feasible .
ks08	1		frances has had the drapes cleaned .
ks08	1		shirley seems to have fred promoted .
ks08	1		nina got bill elected to the committee .
ks08	1		we got our car radio stolen twice on holiday .
ks08	1		frances has had her clean the drapes .
ks08	1		nina got them to elect bill .
ks08	1		the news was dealt with carefully .
ks08	1		the tree was looked after by kim .
ks08	1		we can not put up with the noise anymore .
ks08	1		he will keep up with their expectations .
ks08	1		this noise can not be put up with .
ks08	1		their expectations will be kept up with .
ks08	1		they paid a lot of attention to the matter .
ks08	1		the son took care of his parents .
ks08	1		the matter was paid a lot of attention to .
ks08	1		a lot of attention was paid to the matter .
ks08	0	*	new york was slept in .
ks08	0	*	the lake was camped beside by my sister .
ks08	1		the lake is not to be camped beside by anybody .
ks08	0	*	six inches were grown by the boy .
ks08	0	*	a mile to work was run by him .
ks08	1		the beans were grown by the gardener .
ks08	1		the plums were weighed by the grocer .
ks08	0	*	san francisco has been lived in by my brother .
ks08	1		the house has been lived in by several famous personages .
ks08	0	*	seoul was slept in by the businessman last night .
ks08	1		this bed was surely slept in by a huge guy last night .
ks08	1		rosie got struck by lightning .
ks08	1		i got phoned by a woman friend .
ks08	1		he got hit in the face with the tip of a surfboard .
ks08	1		john 's bike got fixed or got stolen .
ks08	0	*	the lesson got read by a priest .
ks08	0	*	the letter got written by a poet .
ks08	0	*	tom got understood to have asked for a refund .
ks08	0	*	mary got heard to insult her parents .
ks08	1		is john clever ?
ks08	1		who is clever ?
ks08	1		how clever you are !
ks08	1		be very clever .
ks08	1		i ask you if this is what you want .
ks08	1		would you mind taking out the garbage ?
ks08	1		can the child read the book ?
ks08	1		what can the child read ?
ks08	1		which version did they recommend ?
ks08	1		with what did the baby eat the food ?
ks08	1		how did he eat the food ?
