swb04	0	*	a rat yesterday died .
swb04	1		chris walks , eats broccoli , and plays squash .
swb04	1		every family was saved by some dog or other .
swb04	1		john frightens himself .
swb04	1		susan told herself a story .
swb04	1		susan told a story to herself .
swb04	0	*	susan devoted her to linguistics .
swb04	1		nobody told susan about her .
swb04	1		susan thinks that nobody likes herself .
swb04	1		susan thinks that nobody likes her .
swb04	0	*	that picture of susan offended herself .
swb04	1		sandy offended jason .
swb04	0	*	he enjoys themselves .
swb04	0	*	she enjoys himself .
swb04	0	*	nobody told susan .
swb04	1		nobody talked to susan .
swb04	0	*	nobody talked to susan .
swb04	1		we compared him .
swb04	1		we compared them .
swb04	1		i met the person who they visited .
swb04	1		despite their average age , the charge boasts an experienced roster .
swb04	1		the cardinal plays arizona state at 7 p.m saturday at stanford .
swb04	1		the picture of sandy was awesome .
swb04	1		the picture was awesome .
swb04	1		we could n't find any pictures of blind mello jello .
swb04	0	*	leslie slept the baby .
swb04	0	*	dana relied .
swb04	0	*	pat devoured .
swb04	0	*	chris handed .
swb04	0	*	chris handed a ticket .
swb04	0	*	we put .
swb04	0	*	we put on the shelf .
swb04	0	*	we put the book .
swb04	1		dana relied on hilary .
swb04	1		pat devoured the sandwich .
swb04	1		chris handed bo a ticket .
swb04	1		we put the book on the shelf .
swb04	0	*	dana walked and leslie running .
swb04	0	*	the putter of books on the table left .
swb04	0	*	the putter on the table left .
swb04	1		jan gave dale a book .
swb04	1		jan gave a book to dale .
swb04	1		jan handed dale a book .
swb04	1		jan handed a book to dale .
swb04	0	*	kris donated the library a book .
swb04	1		dale gave brooke a hard time .
swb04	0	??	dale gave a hard time to brooke .
swb04	1		pat coughed .
swb04	1		pat coughed the napkin off the table .
swb04	1		the horse kicked me .
swb04	1		they yelled their way into the meeting .
swb04	1		kim is standing here .
swb04	1		sandy has eaten dinner .
swb04	1		the boat floated down the river sank .
swb04	1		the horse taken to the hospital died .
swb04	1		the boat that was floated down the river sank .
swb04	1		the thief seized by the police turned out to be our cousin .
swb04	1		the evidence that was assembled by the prosecution convinced the jury .
swb04	1		the thief who was seized by the police turned out to be our cousin .
swb04	1		lou forgot the umbrella was broken .
swb04	1		dana learned the umbrella was broken .
swb04	1		dana learned a new theorem in class .
swb04	1		lynn likes the hat on the shelf .
swb04	1		the artist drew the child with a bicycle .
swb04	1		lynn bought the hat on the shelf .
swb04	1		the cat was bitten by the dog .
swb04	1		the cat was bitten .
swb04	1		pat handed chris a note .
swb04	1		chris was handed a note by pat .
swb04	0	*	dumb ideas are put notions in children 's heads .
swb04	0	*	the patient was died by the doctor .
swb04	0	*	the doctor died the patient .
swb04	0	*	pat handed chris .
swb04	0	*	chris was handed by pat .
swb04	1		tv puts dumb ideas into their heads .
swb04	1		dumb ideas are put into their heads by tv .
swb04	1		dumb ideas are put into their heads .
swb04	0	*	dumb ideas are put .
swb04	0	*	dumb ideas are put by tv .
swb04	0	*	him was arrested by the police .
swb04	1		the cat got bitten by the dog .
swb04	1		liked by many people but respected by few , jean will have to run an aggressive reelection campaign .
swb04	1		anyone handed a note will be watched closely .
swb04	1		there are storm clouds gathering .
swb04	1		the fbi is keeping close tabs on pat .
swb04	1		pat is on the roof .
swb04	1		pat is fond of chris .
swb04	1		pat is singing the blues .
swb04	0	*	pat is likes chris .
swb04	0	*	pat is mere .
swb04	1		there were many people fond of pat .
swb04	1		there are people looking through the window .
swb04	0	*	pat took a seat available .
swb04	0	*	i looked for a seat available .
swb04	1		a unicorn is in the garden .
swb04	0	*	merle gave there a book .
swb04	1		that the giants had lost really mattered .
swb04	1		that the giants had lost mattered .
swb04	1		it really mattered that the giants had lost .
swb04	1		that chris knew the answer never occurred to pat .
swb04	1		it occurred to pat that chris knew the answer .
swb04	1		that the media discuss celebrities ' sex lives disturbs many americans .
swb04	1		it disturbs many americans that the media discuss celebrities ' sex lives .
swb04	1		that the giants lost the series sucks .
swb04	1		it sucks that the giants lost the series .
swb04	1		that the giants lost the series bites .
swb04	1		it bites that the giants lost the series .
swb04	0	*	that pat is innocent proves .
swb04	1		it proves that pat is innocent .
swb04	1		it suggested that sandy had lied .
swb04	0	*	i gave it to pat .
swb04	1		we forgot that we needed invitations .
swb04	1		nobody saw that pat had arrived .
swb04	1		carrie kicked the bucket last night .
swb04	1		the fbi kept tabs on sandy .
swb04	1		the candidates take advantage of the voters .
swb04	1		the police put tabs on undocumented workers .
swb04	1		we like ourselves .
swb04	1		nobody likes us .
swb04	0	*	leslie likes ourselves .
swb04	0	*	ourselves like ourselves .
swb04	1		she voted for herself .
swb04	0	*	we gave us presents .
swb04	1		we gave ourselves presents .
swb04	1		we gave presents to ourselves .
swb04	0	*	we gave us to the cause .
swb04	1		we gave ourselves to the cause .
swb04	0	*	leslie told us about us .
swb04	0	*	leslie told ourselves about us .
swb04	1		we think that leslie likes us .
swb04	0	*	we think that leslie likes ourselves .
swb04	1		our friends like us .
swb04	1		those pictures of us offended us .
swb04	0	*	we found your letter to ourselves in the trash .
swb04	0	*	vote for you !
swb04	1		vote for yourself !
swb04	0	*	we appeared to them to vote for themselves .
swb04	1		we admired the pictures of us in the album .
swb04	1		we admired the pictures of ourselves in the album .
swb04	1		leslie used a pen .
swb04	1		we put the pigs in a pen .
swb04	1		we need to pen the pigs to keep them from getting into the corn .
swb04	1		they should pen the letter quickly .
swb04	1		the car wo n't run .
swb04	1		this dye will run .
swb04	1		she can run an accelerator .
swb04	1		these stockings will run .
swb04	1		we need another run to win .
swb04	1		lee saw the student with a telescope .
swb04	1		i forgot how good beer tastes .
swb04	1		visiting relatives can be boring .
swb04	1		if only superman would stop flying planes !
swb04	1		that 's a new car dealership .
swb04	1		i know you like the back of my hand .
swb04	1		max is on the phone now .
swb04	1		i saw her duck .
swb04	1		i 'm creating a committee . kim – you 're in charge .
swb04	1		lights go out at ten . there will be no talking afterwards .
swb04	1		they found the book on the atom .
swb04	1		which experts testified against defendants who exposed them ?
swb04	1		list all experts for the defendant who represented himself .
swb04	1		list associates of each defendant who speaks spanish .
swb04	0	*	they lost themselves ' books .
swb04	1		some sentences go on and on and on .
swb04	0	*	sentences some go on and on and on and on .
swb04	1		that surprised me .
swb04	0	*	i noticed the .
swb04	1		they were interested in his .
swb04	1		this is my favorite .
swb04	1		a large dog chased a small cat .
swb04	1		some people yell at noisy dogs in my neighborhood .
swb04	1		some people yell at the dogs in my neighborhood .
swb04	1		some people yell at the dogs .
swb04	1		some people yell at noisy dogs .
swb04	1		some people yell at dogs .
swb04	1		some people consider the noisy dogs dangerous .
swb04	1		some people consider the dogs in my neighborhood dangerous .
swb04	1		some people consider noisy dogs in my neighborhood dangerous .
swb04	1		some people consider the dogs dangerous .
swb04	1		some people consider noisy dogs dangerous .
swb04	1		some people consider dogs in my neighborhood dangerous .
swb04	1		some people consider dogs dangerous .
swb04	1		people with children who use drugs should be locked up .
swb04	1		this disease gave leslie a fever in rome .
swb04	1		the love of my life and mother of my children would never do such a thing .
swb04	1		most elections are quickly forgotten , but the election of 2000 , everyone will remember for a long time .
swb04	0	*	it is painting by klee or drawing by miro that the museum displays no .
swb04	1		the defendant denied the accusation .
swb04	0	*	the teacher disappeared the problem .
swb04	0	*	the teacher handed the student .
swb04	1		the bird sings .
swb04	0	*	the bird sing .
swb04	0	*	birds sings .
swb04	1		the birds give the worm a tug .
swb04	0	*	the bird give the worm a tug .
swb04	0	*	the birds gives the worm a tug .
swb04	1		terry delighted in my pain .
swb04	0	*	terry delighted .
swb04	0	*	terry delighted my pain .
swb04	1		kerry remarked it was late .
swb04	1		what additional categories and rules would be required to handle these verbs ?
swb04	1		we created a monster .
swb04	0	*	i was already aware of fact .
swb04	0	*	the defendant deny the allegation .
swb04	0	*	the defendants denies the allegation .
swb04	1		the defendant walks .
swb04	0	*	the defendant walk .
swb04	0	*	the defendants walks .
swb04	1		how many feature structures categories can label the first daughter ?
swb04	1		the child put the toy on the table .
swb04	1		the teacher became angry with the students .
swb04	0	*	the teacher became .
swb04	1		the jury believed the defendant lied .
swb04	1		the guests dined .
swb04	1		we relied on leslie .
swb04	0	*	we relied above leslie .
swb04	1		we celebrated in the streets .
swb04	1		we celebrated in the streets in the rain on tuesday in the morning .
swb04	0	*	the children are happy of ice cream .
swb04	0	*	the children are fond with the ice cream .
swb04	0	*	the children are fond that they have ice cream .
swb04	1		a magazine appeared on the newsstands .
swb04	1		a magazine about crime appeared on the newsstands .
swb04	1		newsweek appeared on the newsstands .
swb04	0	*	newsweek about crime appeared on the newsstands .
swb04	1		the report that crime was declining surprised many people .
swb04	1		the book surprised many people .
swb04	0	*	the book that crime was declining surprised many people .
swb04	1		the storm arrived after the picnic .
swb04	0	*	the storm arrived while the picnic .
swb04	1		the storm arrived while we ate lunch .
swb04	0	*	this dogs barked .
swb04	1		these dogs barked .
swb04	1		a chair was broken .
swb04	1		they want them arrested .
swb04	1		they preferred them arrested .
swb04	1		we preferred them on our team .
swb04	1		with my parents as supportive as they are , i 'll be in fine shape .
swb04	0	*	we walks .
swb04	0	*	few dog barked .
swb04	1		the dogs barked .
swb04	1		i walk and dana runs .
swb04	1		they like us .
swb04	0	*	us like them .
swb04	1		kim likes dogs .
swb04	1		dogs like kim .
swb04	1		the person responsible confessed .
swb04	0	*	the person confessed responsible .
swb04	0	*	the cat slept soundly and furry .
swb04	0	*	the soundly and furry cat slept .
swb04	1		chris walks , pat eats broccoli , and sandy plays squash .
swb04	1		there was some particular dog who saved every family .
swb04	1		susan frightens her .
swb04	1		susan told her a story .
swb04	1		susan told a story to her .
swb04	1		susan devoted herself to linguistics .
swb04	1		nobody told susan about herself .
swb04	1		that picture of susan offended her .
swb04	1		he offended sandy .
swb04	0	*	i enjoy yourself .
swb04	1		they talk to themselves .
swb04	1		nobody told susan .
swb04	1		protect yourself !
swb04	0	*	protect you !
swb04	1		i met the person who left .
swb04	1		leslie slept .
swb04	0	*	chris handed bo .
swb04	1		dana walked and leslie ran .
swb04	0	*	dana walking and leslie ran .
swb04	0	*	dana walking and leslie running .
swb04	0	*	the putter of books left .
swb04	1		kris donated a book to the library .
swb04	1		the police sprayed the protesters with water .
swb04	1		the police sprayed water on the protesters .
swb04	1		the students drove cars .
swb04	1		these cars drive easily .
swb04	1		the horse kicked me black and blue .
swb04	1		they yelled .
swb04	1		the horse raced past the barn fell .
swb04	1		the horse that was raced past the barn fell .
swb04	1		the boat seen down the river sank .
swb04	1		the evidence assembled by the prosecution convinced the jury .
swb04	1		lou forgot the umbrella .
swb04	1		lou forgot the umbrella in the closet .
swb04	1		lou hoped the umbrella was broken .
swb04	0	*	lou hoped the umbrella in the closet .
swb04	0	*	lou put the umbrella was broken .
swb04	1		lou put the umbrella in the closet .
swb04	1		the artist drew the child with a pencil .
swb04	1		the dog bit the cat .
swb04	0	*	the cat was bitten the mouse .
swb04	0	*	the cat was bitten the mouse by the dog .
swb04	0	*	chris was handed sandy a note by pat .
swb04	1		chris was handed a note .
swb04	0	*	chris was handed sandy a note .
swb04	1		tv puts dumb ideas in children 's heads .
swb04	1		dumb ideas are put in children 's heads by tv .
swb04	1		dumb ideas are put in children 's heads .
swb04	0	*	dumb ideas are put notions in children 's heads by tv .
swb04	1		the patient died .
swb04	0	*	the patient was died .
swb04	0	*	chris was handed .
swb04	0	*	tv puts dumb ideas .
swb04	1		he was arrested by the police .
swb04	1		the cat got bitten .
swb04	0	*	the cat were bitten by the dog .
swb04	1		there is a monster in loch ness .
swb04	1		it is obvious that pat is lying .
swb04	1		pat is the captain of the team .
swb04	0	*	pat is hate chris .
swb04	1		there is a unicorn in the garden .
swb04	1		there was a felon elected to the city council .
swb04	1		there is a seat available .
swb04	0	*	a seat available was in the last row .
swb04	1		many people were fond of pat .
swb04	1		people are looking through the window .
swb04	1		a felon was elected to the city council .
swb04	0	*	there loved sandy .
swb04	0	*	we talked to them about there .
swb04	1		it mattered that the giants had lost .
swb04	1		that dogs bark annoys people .
swb04	1		it annoys people that dogs bark .
swb04	1		that chris knew the answer occurred to pat .
swb04	1		it never occurred to pat that chris knew the answer .
swb04	1		that the cardinal won the game gave sandy a thrill .
swb04	1		it gave sandy a thrill that the cardinal won the game .
swb04	0	*	that sandy had lied suggested .
swb04	0	*	it loved sandy .
swb04	1		cohen proved the independence of the continuum hypothesis .
swb04	1		cohen proved that the continuum hypothesis was independent .
swb04	1		we forgot our invitations .
swb04	1		nobody saw pat .
swb04	1		that fido barks annoys me .
swb04	1		fido barks .
swb04	1		chris dreads the bucket .
swb04	1		the candidates bring advantage to the voters .
swb04	1		tabs are kept on suspected drug dealers by the fbi .
swb04	1		advantage is taken of every opportunity for improvement .
swb04	1		the bucket was kicked by pat .
j_71	1		max ate the apple and sally the hamburgers .
j_71	1		ivan plays bassoon , boris oboe , and schwarz english horn .
j_71	1		mary is believed to be , and sue definitely is , pregnant .
j_71	0	*	dolores gave incriminating evidence about harry to the fbi , and frank sent to his mother-in-law .
j_71	1		sam plays the bassoon , and max the saxophone .
j_71	0	*	sam played tuba whenever max sax .
j_71	0	*	john plays bagpipe despite the fact that bill the bassoon .
j_71	1		bill ate the peaches and harry the grapes .
j_71	1		john has written the words , and paul the music .
j_71	0	*	john has written the words , and paul has the music .
j_71	0	*	simon quickly dropped the gold , and jack suddenly the diamonds .
j_71	0	*	max sometimes beats his wife , and ted frequently his dog .
j_71	1		are quickly drops and sometimes beats , not just dropped and beats : .
j_71	1		max sometimes beats his wife , and ted his dog .
j_71	1		i did n't eat fish , bill did n't eat rice , and harry did n't eat roast beef .
j_71	0	*	i did n't eat fish , bill rice , and harry roast beef .
j_71	1		john writes poetry in the garden , and max in the bathroom .
j_71	1		charlie went into the bedroom at 5:30 , and lola at 5:35 .
j_71	0	*	i want bob to shave himself , and mary to wash himself .
j_71	0	*	bill is depending on harry to find the way to the party , and sue to find the way home .
j_71	1		arizona elected goldwater senator , and pennsylvania , goldstein .
j_71	1		max writes poetry in the bathroom , and schwarz radical pamphlets .
j_71	1		maytag will give a brand new dryer to the winner of the mrs. albania contest , and general electric , four hundred light bulbs .
j_71	1		jack begged elsie to get married , and wilfred , phoebe .
j_71	1		harry told sue , and tom sally , that albania is a lovely place for a vacation .
j_71	0	*	joe informed lucy that tagalog is spoken in the philippines , and bill jane that khmer is spoken in cambodia .
j_71	0	*	frank forced tom to shave himself , and sam , harry to watch .
j_71	0	*	willy put the flowers in a vase , and charlie the book on the table .
j_71	1		arizona elected goldwater senator and massachusetts mccormack .
j_71	1		arizona elected goldwater senator and mccormack congressman .
j_71	0	*	bill ate the peaches , and harry .
j_71	1		bill ate the peaches , and harry , too .
j_71	1		either bill ate the peaches , or harry .
j_71	1		either ivan will write the play , or boris will .
j_71	1		tom has n't smoked the grass , nor has reuben .
j_71	1		frank may have told chet , and joe may have , too .
j_71	1		bill must quickly eat the peaches , and harry must , too .
j_71	1		charlie will leave town if his mother-in-law does n't .
j_71	1		tom swam the english channel because he believed that suzy ex .
j_71	1		anyone who can , should show me how to wiggle my ears .
j_71	1		if he has n't yet , john should try to climb the eiffel tower .
j_71	1		i like bill 's wine , but max 's is even better .
j_71	0	*	i like bill 's new wine , but max 's old is even better .
j_71	1		bill 's funny story about sue and max 's about kathy both amazed me .
j_71	0	*	bill 's funny story about sue and max 's boring about kathy both amazed me .
j_71	1		we may safely disregard both nixon 's assurances to us that the war will end and agnew 's that we are incapacitated .
j_71	0	*	klemperer 's recording of ives ' 1st on columbia and von karajan 's of beethoven 's 6th are my favorite .
j_71	0	*	i was astounded by sam 's stunning defeat of ira in the chess tournament , and walt 's of willy in the hopscotch contest .
j_71	1		either ted 's gin from new jersey or bill 's from iowa will satisfy the uneducated palates of our guests .
j_71	0	*	i borrowed fred 's diagram of a snake 's fang because steve 's of a spider 's eye had been stolen .
j_71	1		richter 's performance of bach on the piano does n't please me as much as glenn gould 's .
j_71	1		jerry 's attempt to blow up the pentagon .
j_71	1		jack hates sue and is loved by mary .
j_71	1		vera sent a baby alligator to max and a leather dinosaur to phyllis .
j_71	1		either sam plays the bassoon or jekyll the oboe .
j_71	1		sam does n't play bassoon , nor medusa oboe .
j_71	0	*	bill ate the peaches , but harry the grapes .
j_71	1		i no more could have stolen that steak than jack the diamonds .
j_71	1		bill ate more peaches than harry did grapes .
j_71	0	*	bill ate the peaches and harry did the grapes .
j_71	0	*	tom will smoke the grass , and reuben has the hash .
j_71	1		if the ants were called elephants and elephants ants , i 'd be able to squash an elephant .
j_71	1		simon quickly dropped the gold , and jack the diamonds .
j_71	1		bob tried to wash himself , and mary to read the funnies .
j_71	1		harry told sue that albania is a lovely place for a vacation , and tom told sally that albania is a lovely place for a vacation .
j_71	1		harry told sue that albania is a lovely place for a vacation , and tom .
j_71	1		max seemed to be trying to begin to love harriet , and fred to be trying to begin to love sue .
j_71	1		max seemed to be trying to force ted to leave the room , and walt , ira .
j_71	0	*	max seemed to be trying to force ted to leave the room , and walt to stay a little longer .
j_71	0	*	arizona elected goldwater senator , and massachusetts , mccormack .
j_71	0	*	millie will send the president an obscene telegram , and paul , the secretary a rude letter .
j_71	0	*	maytag will give a brand-new dryer to the winner of the mrs .
j_71	0	*	bill did n't eat the peaches , nor harry .
j_71	1		bill ate the peaches , and harry did , too .
j_71	0	*	bill must quickly eat the peaches , and harry must slowly .
j_71	1		whenever russia has made a major political blunder , the u.s. has too .
j_71	1		bill 's story about sue and max 's about kathy both amazed me .
j_71	1		i bought three quarts of wine and two of clorox .
j_71	1		scientists at the south hanoi institute of technology have succeeded in raising one dog with five legs , another with a cow 's liver , and a third with no head .
j_71	1		bill 's story about sue may be amazing , but max 's is virtually incredible .
j_71	1		i like bill 's yellow shirt , but not max 's .
j_71	1		bill 's funny story about sue and max 's boring one about kathy both amazed me .
j_71	1		bill 's wine from france and ted 's from california can not be compared .
j_71	0	*	as a teacher , you have to deal simultaneously with the administration 's pressure on you to succeed , and the children 's to be a nice guy .
j_71	1		neither von karajan 's recording of beethoven 's 6th on columbia nor klemperer 's on angel has the right tempo .
j_71	0	*	gould 's performance of bach on the piano does n't please me anywhere as much as ross 's on the harpsichord .
j_71	0	*	tom 's dog with one eye attacked frank 's with three legs .
j_71	0	*	because steve 's of a spider 's eye had been stolen , i borrowed fred 's diagram of a snake 's fang .
j_71	1		neither von karajan 's recording of beethoven 's 6th on columbia nor klemperer 's has the right tempo .
j_71	1		tom 's dog with one eye attacked fred 's .
j_71	1		i borrowed fred 's diagram of a snake 's eye because steve 's had been stolen .
j_71	1		jerry attempted to blow up the pentagon .
j_71	1		so fast did he run that nobody could catch him .
j_71	1		bill bought a red house , and max bought one too .
c-05	1		john wrote the book .
c-05	1		the book was written by john .
c-05	1		danger was sensed by john .
c-05	1		a black smoke was emitted by the radiator .
c-05	1		a copy of guns , germs , and steel has now been received by each member of the incoming class .
c-05	1		i was told that by a little bird .
c-05	1		the argument was summed up by the coach .
c-05	1		john has seen the book .
c-05	0	*	the book has seen by mary .
c-05	1		breakfast is eaten nude by the campers .
c-05	1		breakfast is eaten by the campers nude .
c-05	1		the metal was hammered flat by john .
c-05	0	*	the metal was hammered by john flat .
c-05	1		mary was given the book by john .
c-05	1		i was convinced to leave by john .
c-05	1		i was convinced by john to leave .
c-05	1		the car was driven to maine by john .
c-05	1		the book was given to mary by john .
c-05	1		the book was given by john to mary .
c-05	0	*	testimony was given about himself by the suspect .
c-05	0	*	books were sent to each other by the students .
c-05	0	*	money was hidden from himself by bill .
c-05	0	*	medals were given to themselves by the generals .
c-05	0	*	medals were given to each other by the generals .
c-05	0	*	tabs were kept on each other by the agents .
c-05	1		testimony was given by the suspect about himself .
c-05	0	*	money was given to his mother by every boy .
c-05	1		books were given to no student by any professor .
c-05	1		tabs were kept on no criminal by any agent .
c-05	1		books were given to each student by the other .
c-05	1		chocolate eggs were hidden from each child by the other .
c-05	1		books were given to every student by his mother .
c-05	1		tabs were kept on every agent by his supervisor .
c-05	1		books were taken from no student by any professor .
c-05	1		it was believed by everybody that mary was a thief .
c-05	1		that professor is feared by all students .
c-05	1		mary was respected by john .
c-05	1		ted was bitten by the spider .
c-05	0	*	the book was by john written .
c-05	0	*	the argument was summed by the coach up .
c-05	1		the paper was written up by john .
c-05	0	*	the paper was written by john up .
c-05	1		john was spoken to by mary .
c-05	0	*	john was spoken by mary to .
c-05	1		the book was seen by mary .
c-05	0	*	john was seen the book .
c-05	1		the book was written .
c-05	0	*	john was spoke by mary to .
c-05	1		the table was wiped clean by john .
c-05	0	*	the table was wiped by john clean .
c-05	0	*	mary was given by john the book .
c-05	1		john was believed to be telling the truth by mary .
c-05	1		john was believed by mary to be telling the truth .
c-05	1		the car was driven by john to maine .
c-05	1		it was believed by the students that they would have an exam .
c-05	0	*	the magazines were sent to herself by mary .
c-05	0	*	chocolate eggs were hidden from each other by the children .
c-05	1		the magazines were sent by mary to herself .
c-05	1		chocolate eggs were hidden from no child by any adult .
c-05	1		tabs were kept on each agent by the other .
c-05	1		chocolate eggs were hidden from every child by his mother .
c-05	1		books were taken from no student and given to mary .
c-05	0	*	books were taken from no student and given to mary by any professor .
c-05	1		books were taken from each student by the other .
c-05	1		books were taken from each student and given to mary .
c-05	0	*	books were taken from each student and given to mary by the other .
r-67	1		a gun went off which i had cleaned .
r-67	0	*	what did that bill wore surprise everyone ?
r-67	1		i know a boy who is mad at john .
r-67	1		he threw into the wastebasket the letter .
r-67	0	*	she asked whether it looked like rain a man who was near the window .
r-67	1		i know a man who john is taller than .
